title,selftext,author,created_utc,score,subreddit,tickers_mentioned
Should I move some of my NVDA stock to S&P500 or something else?,"Currently, I have ~$27,000 of NVDA stock. I didn't invest this money myself, but it has been doing pretty well over the years and I occasionally take from it when I need to make a larger purchase. I've been looking into investing, and I've seen people say that having an entire fund into an individual stock isn't a good idea. Do you guys suggest that I take some (or all?) of it and invest into the S&P500? Or possibly something else?

Thanks!

Edit:

I should have mentioned: this is my only investment. I know diversifying is a good idea, I just don't know if I should take any money out of NVDA now to invest in something else or just put any future investments in a stock that covers multiple companies. ",tortoise2022,2025-06-05 17:34:06,10,investing,NVDA
Costco Vs NVidia compare P/E and growth rates,"Costco trades at higher PE than NVDA, with lower growth rates, can I know why? 

Analysts are blind folded and follow stock price to give there ratings. Most of the retail stocks trades between 10 to 25.


P/E
	•	Costco (COST): Approximately 60
	•	NVIDIA (NVDA): Approximately 45


Revenue Growth

	•	Costco:
	•	Approximately 6% year-over-year for the twelve months ending May 31, 2025.  

	•	NVIDIA:
	•	Approximately 86% year-over-year for the twelve months ending April 30, 2025.  


Why has investing become so complicated? ",Dizzy_Maybe8225,2025-06-05 11:18:02,0,investing,NVDA
"AMD, ADI, MPWR or NXPI? Who is going to profit after Nvda?","Looking at these chip makers trying to compare the fair value of all of them and see who's going to make up for the Lost Revenue or share revenue from Nvidia. Any opinions? It looks like AMD is the most likely to chip away at Nvidia GPU Market, but those others have their own competitive advantages in different areas. MPWR is the only one with no debt but they all seem a little undervalued. ",danrennt98,2025-06-04 17:09:53,0,investing,NVDA
"Sold Hood and started positions in Apple, Google, NVDA today","Recently I sold all my Hood shares (I got 4300 shares). Got some cash ready and didn't want to miss any market rallies, so I used 1/3 of my available funds to start:

300 shares NVDA (about $41k)
150 shares Google ($26k)
60 shares Apple ($12$)

What do you think? I heard lots of good things about VEO 3 and Google is one of the leaders in quantum computing. Apple is always a strong company. They will have smart glasses & foldable phones next year maybe. Then NVDA with a great ER beat but stock got hold down due to tariff news. These 3's average price targets have about 15-25% upside. I'll be happy if they give me 15-20% return by year's end. ",coopermug,2025-05-30 01:27:26,0,investing,NVDA
Semis not recovering despite new wave of AI spending?,"Looking at how SMH did recently I can't help to feel frustrated with my position in this sector. The tariffs threat is still here, but on the other hand we had several new multi billions investment planned for building AI factories, which will need the entire semis production chain. There is a clear surge in the robotics and autonomous driving sector. This will need more GPUs than we currently have.
Moreso, we have seen how NVDA keeps delivering. And yet, SMH can't recover some of its previous highs.

I am fully aware that this is a cyclical and high beta sector, but it feels now that the bad perform has stretched for too long.

Thoughts?",SurveyIllustrious738,2025-05-29 07:45:20,6,investing,NVDA
NVIDIA Earnings Tomorrow – The Market’s Locomotive Report. Thoughts?,"NVIDIA is reporting earnings tomorrow, and honestly, it feels like the entire market is holding its breath. Whether you're in tech, semis, or just broad index funds, NVIDIA has become the locomotive pulling this market forward.

Investor sentiment, momentum,... — all could shift depending on how NVDA performs.

Personally, I am expecting a really strong report. Demand for AI infrastructure is still booming, The AI Economy is booming, and NVIDIA has been at the center of it.

What are your expectations? Bullish, cautious, or sitting on the sidelines?",ZeroWallStreet,2025-05-27 15:15:46,41,investing,NVDA
I've got called old fashion for investing in industrial stocks instead of all tech and ai stocks,"My mate told me I'm old fashioned for investing in the industrial stocks like swk, cat, union pacific. I absolutely love those stocks but that's true they kinda forgotten by all the nvda holders and all the 'trendy' stocks.
How do you see that, can stocks be out-dated?",moodyhighway,2025-05-26 17:16:57,32,investing,NVDA
Buying Puts For A Correction,"Last week, I sold a few stocks, expecting that the S&P 500 (SPX) (SPY) was due for a pullback/correction. Since then, the SPY made a triple top at 595.54 on May 20th, close to its Dec 2024 top of 609.07, and Feb 19, 2025 top of 613, – **this looks like a triple top unless NVDA takes it higher Wednesday / Thursday after earnings.** The SPY closed at 579.11 on Friday, the 23rd, almost 3% lower. I believe this is the start of a correction, which should likely take the SPY to around 540, about 10% lower. **I plan to buy July 31st and August 31st, 540 strike price, SPY puts.**

**Why am I bearish?**

**There are the 4 main reasons:**

1. The first and foremost reason for the weaknesses in bonds is higher borrowing costs for the US government. The 30-year treasury yield currently stands at 5.04% and seems likely to climb as the US Congress passes a budget with a running deficit of 124% of GDP, which increases the deficit further. It also assumes a large amount of customs duties as tariff income, and DOGE cost-cutting as savings. In my opinion, both are rosy projections and will probably exacerbate the deficit. Interest **payments have surpassed defence as the largest line item on the government’s books.** The downgrade from Moody’s will further increase interest rates, which will lead to a drop in the stock markets.
2. The second is tariffs, which will show up in earnings in Q2-Q3; we can’t escape them. Even as tariffs have whittled down to an estimated 15% to 20% on average, we shouldn’t forget that last year, tariffs averaged 3-4%. This is a fourfold increase and will fuel inflation and stagflation, and affect corporate bottom lines if they’re not passed on. And passing them on to customers would likely lead to a decrease in demand, which would still reduce corporate bottom lines. There are no easy solutions to tariffs.
3. The third is an overpriced S&P 500 index, which at 5,803, yields an earnings yield of $260/5,803 = 4.48%. Why would you buy a risk-yielding asset for 4.48% when the 10-year U.S. treasury offers you 4.54%? The S&P 500 is priced at 22.3 times 2025 earnings, higher than the 10-year average of 19.5. Besides, the 19.5x multiple was when interest rates averaged closer to 3%. Simply, the risk premium is not enough for me.
4. The fourth is the persistent weakness and uncertainty in economic data. Home sales are one example. According to Redfin, 56,000 home purchase contracts fell through in April 2025, or about 14% of sales, a level last seen in 2017. Existing home sales fell another 2% in April on top of the large drop in March of 5%, the largest drop since 2022. PMI readings for services and manufacturing came in at 52.3 for April, a decent number by any standards, but with accompanying color stating the obvious – **“Detrimental concerns of tariff uncertainties on demand and supply chains.”** Tariff uncertainty has led to the largest accumulation of inventories in the last 18 years. Given this buildup, it would only be fair to assume that the next two quarters will not grow as well as Q1-2025.

Uncertainty on tariffs (Friday’s call for 50% tariffs on the EU and 25% tariffs on iPhones, not made in the US) increases volatility in bond and stock markets. Other, similar arbitrary executive actions, such as the revocation of Harvard University’s ability to enroll international students, can also have economic repercussions. Currently, like so many other cases on immigration and tariffs challenging executive actions, this one too is in court. Which one could lead to a constitutional crisis? All of these suggest that bond markets could remain weak for a “structural credit risk” reason – the US never had that problem, but I believe it could remain a problem during the Trump presidency. It already is a bearish indicator in the form of higher borrowing costs from international lenders not willing to lend at lower rates.

**How much longer can Buy The Dip save the stock market? We are ignoring the dangers ahead.**

The CNN Greed and Fear index has gone from Extreme Fear to Greed in just one month and is flirting with Extreme Greed.

**In my opinion, the fair value of the SPY is around 520 or 5,200 for the S&P 500, based on a P/E multiple of 20 x 260 per share = 5,200, and I’ll buy Puts to hedge my portfolio for the dangers ahead.**



*  ",Fountainheadusa,2025-05-25 18:15:59,7,investing,NVDA
"Diversifying into Crypto Stocks, Your Picks?","I’ve recently started diversifying into crypto-adjacent stocks to ride the broader wave without being 100% in tokens. I’ve picked up COIN, Marathon Digital (MARA), and Nvidia (NVDA). Coinbase for obvious reasons, Marathon for the mining exposure, and Nvidia because those GPUs aren’t going anywhere. I’m curious, what crypto-related stocks are you buying or watching right now? ",BrenOnBlockchain,2025-05-23 20:56:30,0,investing,NVDA
GENIUS stablecoin and potential push for tokenization,"/\* posted in /stocks but was removed due to off-topic...

It is entertaining to read X recently. We have a lot of users calling for Fed to cut interest rates, in hope that the rate cut will push economic growth and reduce treasury yield. We have a lot of users calling for Fed to increase interest rate, so it makes USD more appealing and reduces treasury yield. Regardless, treasury yield keeps going up. The same story of basis trade and carry trade is playing again today.

It is debatable whether we want a stronger dollar or a weak dollar, but reducing treasury yield seems to be the common goal. How could we easily create more demands for U.S. treasury bonds, when both sides of the aisle embraces the deficit expansion to the core? Well, we can force people into buying treasury bonds, we can wage a war to scare people, or we can create some phantom demands. This is where the GENIUS act may come handy.

The grand scheme is to bring assets on-chain, which requires the players to escrow real-world-assets (RWAs) and issue tokens backed with it. Geez, this sounds like mortgage backed securities and ETF already. To trade those assets, we need currencies, mostly the stablecoins. The GENIUS Act requires holding of USD or treasury bonds, which the issuers will gladly support. Let us imagine that we move NYSE and NASDAQ on-chain and create a copy of all stocks, we suddenly create demand for USD, treasury, and stocks from some users that can't access the U.S. market. Even our dear general Kim can tornado his stash and buy Apple at that time.

Wait! This already happened! Kraken tokenized AAPL, NVDA and TSLA today. Many other crypto firms have worked on RWA for years, including stocks, game skins, etc. GAINS even created a 100x leveraged stock trading platform until they halted it due to heavy admin burden to monitor stock earning, dividends, splits, acquisitions, etc.

So we are likely to see a concerted effort to push assets on-chain in the coming months or years, which will benefit stocks like COIN, HOOD, XYZ, PYPL, and other players, and cryptos such as LINK. Electronic stablecoin payments for daily life is another direction, and I wonder how that will affect V and MA. The damage to both may take years though.

Too bad I didn't scoop HOOD at low, but I bought all above anyway.",Moirailogist,2025-05-22 18:58:33,0,investing,"AAPL,NVDA"
I’m scared. Michael Burry is betting against the market…,"Michael Burry—yes, the guy who called the 2008 crash—just went full doomsday on tech stocks.😢

Sold everything.
Loaded up on puts.

And I gotta be honest… I’m a little scared right now…

He dumped all his previous holdings:
•Alibaba
•Baidu
•JD
•Pinduoduo
…gone. 100% out.

Then he went all in on…
Estee Lauder. $EL
A 62% drop over the past 5 years.
Burry’s betting on a beauty comeback while everyone else is chasing AI hype. Bold.

But here’s what really made my eyebrows hit the ceiling:
He bought a mountain of put options—bearish bets on the same stocks he just sold.

His new puts include:
•Baidu
•  $JD
• $PDD
• $BABA
…and wait for it
@nvidia $NVDA
And not just a few. Nvidia puts now make up 50% of his entire portfolio.

That’s either legendary conviction…
Or an early screening of the financial horror movie we’re all about to star in.

But when a guy like Burry takes a shot this big, I can’t help but feel a little anxious.

Is he early? Is he wrong? Or are we all dancing on the edge of the cliff again?

What do you think—
Genius move or doomer bait?",Aggressive_Abies_738,2025-05-22 07:12:52,37,investing,NVDA
Thinking about taking some profits from my more volatile stocks. What should I do with the money?,"So I bought a little over a month ago and I'm up pretty big on TSLA, MSTR, NVDA, and SHOP. Since stocks like these tend to be more volatile I'm thinking of taking some profits, but I don't want it to sit in cash. I'd either like to rotate it into my more ""safe"" plays like COST, GOOG, and AMZN and rebalance a bit, or maybe just put the profits into an index. What do you guys think is the better strategy, and which indexes should I be looking at? I'm young and single, so I'd like one that's got some growth in it, maybe pays some dividends too. 

What's a good plan?",WeeniePops,2025-05-22 05:02:30,9,investing,"NVDA,AMZN"
"S&P 500 dips, debt concerns in focus as Trump's tax bill faces overnight test","The S&P 500 slipped in volatile trading and Treasury yields rose on Wednesday as U.S. President Donald Trump's proposed tax-cut law faced a rare overnight hearing aimed at influencing Republican holdouts opposed to the bill's passage.

The House Rules Committee scheduled an unusual 1 a.m. ET hearing that is expected to run well into daylight hours as Republicans try to overcome internal divisions about cuts to the Medicaid health program and tax breaks in high-cost coastal states.

U.S. House of Representatives Speaker Mike Johnson acknowledged, however, that a vote by the full chamber might not happen on Wednesday.

Nonpartisan analysts said the proposed plan could add between $3 trillion and $5 trillion to the federal government's $36.2 trillion debt.

""This tax bill could be a coin toss in its current form; it could go either way,"" said Mariam Adams, managing director at UBS Wealth Management.
""It really depends on how much relief the average investor... (is) receiving. If it can impact and give some kind of faith to individual investors, that could give us a really good rally.""

At 11:53 a.m. ET, the Dow Jones Industrial Average (.DJI) fell 332.05 points, or 0.78%, to 42,345.19, the S&P 500 (.SPX) lost 10.06 points, or 0.17%, to 5,930.40, and the Nasdaq Composite (.IXIC) gained 70.80 points, or 0.36%, to 19,213.51.
Boosting the Nasdaq, Google-parent Alphabet (GOOGL.O) jumped 4.9%, while Nvidia (NVDA.O) and Meta Platforms (META.O) climbed close to 1% each.
Nine of the 11 S&P sub-sectors traded lower, with Health Care (.SPXHC) being the worst hit.

U.S. bonds have been pressured since the start of the week, when Moody's downgraded the country's sovereign credit rating. Yields on the 30-year note were back up to 5.01% on Wednesday, with the benchmark 10-year yield climbing 5.2 basis points to 4.53%.

UnitedHealth Group (UNH.N) dropped 4.5% after a Guardian report said the healthcare conglomerate secretly paid nursing homes thousands in bonuses to help reduce hospital transfers for ailing residents. HSBC also downgraded the stock to ""reduce"" from ""hold"".

In earnings, retailer Target (TGT.N) fell 3.5% after slashing its annual forecast due to a pullback in discretionary spending.
Wolfspeed (WOLF.N) tumbled nearly 70% following a report that the semiconductor supplier was preparing to file for bankruptcy within weeks.

Despite the losses, U.S. stocks have had a solid month so far. The S&P 500 has climbed more than 17% from its April lows, when Trump's reciprocal tariffs roiled global markets.

A pause in the tariffs, a temporary U.S.-China trade truce and tame inflation data have pushed equities higher, although the S&P 500 is still about 3% off its record highs.

Brokerage Morgan Stanley upgraded its stance on U.S. equities to ""overweight"", saying the global economy was still expanding, albeit slowly, amid policy uncertainty.

Meanwhile, bitcoin scaled a fresh all-time high of $109,481.83. Exchange operator Coinbase (COIN.O) gained 2.1% and crypto miners including Riot Platforms (RIOT.O) rose about 3%.

Declining issues outnumbered advancers by a 2.76-to-1 ratio on the NYSE and by a 2.02-to-1 ratio on the Nasdaq.
The S&P 500 posted 12 new 52-week highs and two new lows, while the Nasdaq Composite recorded 41 new highs and 46 new lows.

Reporting by Shashwat Chauhan and Kanchana Chakravarty in Bengaluru; Editing by Pooja Desai and Devika Syamnath",Bobba-Luna,2025-05-21 19:29:12,38,investing,"GOOGL,NVDA"
AMZN to new ATH despite tariffs?,Positions are 3 $240 march 20 2026 puts backed by 70k in TBIL.  The tariffs are of course bad for the retail side but it seems every quarter more and more of profits and revenue are coming from AWS all this AI is going to need data centers and hosting.  I picked $240 because that's just under the 52 week high.  I suppose maybe $230 would be safer but with AWS growing the way it is setting a new all time high in the next 2 years should happen.  If I get assigned above 200 I'll just sell a 2 week ATM or slightly OTM call and close out the position that way.  Shoved the entire premium into TBIL so the interest on that will should help magnify gains and offset some of the losses if I'm wrong.  I'm thinking if tariffs do stay at a blanket 10% Amazon will raise prices and 3rd party sellers will raise prices so profit margin will stay the same but revenue will be slightly inflated. ,Embarrassed_Durian17,2025-05-19 02:13:05,0,investing,AMZN
Experienced trader looking for advice on tools,"I'm a longtime trader who recently caught a sizeable windfall in the markets which has motivated me to do something I've been meaning to do for a long time: Consolidate my various accounts, move to a DMA broker, upgrade my toolsets and services, and hone my skills so I can trade more in this crazy new climate we find ourselves in. I scalp futures contracts almost exclusively, and swing trade the big stocks/funds. I also have long term investments that I don't touch except to rebalance.

I also happen to be a professional software developer, over 20 years with .Net/Rust and various smaller frameworks. I'm getting into algo trading slowly. I have accounts with TradeStation, IBKR, and NinjaTrader since their SDK is C#. I'm probably going to ditch IBKR b/c TradeStation so far has been amazing. NinjaTrader isn't DMA, but being able to write complex algorithms in a programming language I know is a huge plus.

I have some questions about tools as I inherently trust nothing on the internet, I figure everybody is in everybody else's pocket. 
- Is Benzinga Pro everything it's cracked up to be? Or is there a better source of news, e.g. Bloomberg, CNBC, etc. It's expensive, but anything that can give me an edge on the market I consider extremely valuable.
- Is using a trading journal service worth it? I have my eye on TraderSync, but TradeStation comes with some decent reporting tools that export to excel. TraderSync is also expensive so I'm wondering what edge it would give a scalper.
- Are signaling services worth it? I've seen Eagle Investors and Trade Ideas mentioned a few times on various /r's. How do they signal? Webhooks would be great so I could integrate it into MSFT Teams. And yes I know better than to use them as a single source of truth, confirm with other tools.

My current toolset consists of heavy technical analysis, TradingView (ultimate edition or whatever it's called), and Tradestation tools (TS Workstation, Maestro, but I'm not great at backtesting tbh) in addition to Benzinga and other reputable news sources, but they aren't fast enough which is why I'm asking about the signaling services. I do fairly well, > 50% profitable trades and always end up in the green at the end of the month, if even by just a hair :-) I can say with great certainty that moving to DMA has already increased profits, so I'm very willing to invest both time and money learning new tech if it gives me an edge. Their desktop client is amazing, but I'm still learning it. Being able to set trailing stops is extremely nice.

(My ultimate goal btw is to integrate all of this into code I'll write, but that's down the line, I'm in the requirements gathering phase of the SDLC)

Thanks!
",BinaryDichotomy,2025-05-17 00:53:14,5,investing,MSFT
If you could only invest in 5 companies for the rest of your life what would they be?,"Even though single stocks are only 15% of my portfolio, I’m invested in way too many companies right now and want to narrow in on just 5 or 6. If you had to pick just 5 companies that you believe in long term which ones would be at the top of your list? I would probably choose AMZN,  BRK-B, COST, ",False_Comedian_6070,2025-05-16 02:22:42,110,investing,AMZN
Michael Burry’s Scion Asset Management Turns Bearish on NVIDIA and China-related Stocks in the First Quarter,"Thoughts on this aggressive pivot?

https://www.marketwatch.com/story/michael-burrys-scion-bets-against-nvidia-turns-bearish-on-chinese-stocks-440f3d02

>	Michael Burry’s Scion Asset Management made some major changes to its portfolio during the first quarter, according to a filing with the Securities and Exchange Commission released on Thursday.
    
>	Burry — who rose to fame after being featured in the Michael Lewis book “The Big Short” and its subsequent Hollywood film — has opened a big bet against shares of Nvidia Corp. NVDA -0.38% using puts, the filing showed.
    
>	His firm also bought bearish puts on shares of Chinese stocks which he had previously owned outright, including Alibaba Group Holding Ltd.  By BABA -7.57%, Baidu Inc. BIDU -3.58% and JD.com  Inc. JD -3.86%.
    
>	The only long position remaining in Burry’s portfolio, according to the filing, was a bet on shares of Estee Lauder Cos. Inc. EL -0.69%.
    
 > The SEC requires all institutional investment managers that hold over $100 million in certain securities to disclose their positions via quarterly filings known as 13-Fs.",UnpurePurist,2025-05-16 01:48:44,12,investing,NVDA
AI isn’t just hype when half a million chips are involved,"UAE's lining up to import 500K of $NVDA's top-tier chips per year starting 2025. 

G42's getting 100K of those. $MSFT and $ORCL might be building data centers there too. Trump just locked $600B in Saudi deals (chips from $NVDA, $AMD, $QCOM included). If this goes through, the Gulf could be AI's third global power zone. 

Just my take about $CANG, they popped 9.4% this week. Volume 3x normal. EV stock and China-based but I wouldn't be shocked if AI hype is dragging it along for the ride. I’m long $NVDA and holding a small $CANG bag from $2.15 avg. Let's see how this going zz",davicreaker,2025-05-16 01:43:44,49,investing,"MSFT,NVDA"
Will there be another crash after the 90 day pause?,"I’m very new to trading and currently have multiple ETFs in my portfolio but am now starting to look into investing into individual companies. I know with the tariffs the market has been all over the place. I’m wanting to invest into NVDA but am wondering if I should wait till the pause is over and see if I can buy the dip or should I hop in now. I’m not trying to make a quick buc, I’d be holding for 3-5 years minimum. Like I said I’m still new to all of this so please, tell me if I’m talking nonsense and any advice or thoughts would be appreciated.",Hazval,2025-05-15 17:53:48,60,investing,NVDA
Too much liquidity? Feeling a bit lost.,"Hey all, 25M 

Was looking for some general advice regarding liquidity in my portfolio. I have about half my net worth in cash, \~$60K, and for whatever reason, feel like I need to keep saving for a downpayment (yes, I know this is more than enough but trying to fast-track PMI... not sure if that's worth it). I have no real plans to buy within the next year but perhaps in 2027, with the potential to charge some of the mortgage payment to my current GF. Maxed my RothIRA the last two years with holdings in FXAIX primarily, 7% contribution to 401K. and a good chunk of individual holdings in NVDA/CRWV. 

I also sat down recently with a family friend who sells whole and term life insurance... I can't help but feel this is ""too good to be true"" with the research I've done thus far. 

  
Any insight into if I should cut my liquidity down and max my roth/DCA or otherwise + any information on term and whole life, if it's worth it, etc. would be helpful. Trying my best to min-max my financial situation. Thanks. ",ttv_walmartsushi,2025-05-15 16:29:23,7,investing,NVDA
