title,selftext,author,created_utc,score,subreddit,tickers_mentioned
Is a 20% in a week run-up a bit too much or irrational for AMD?,"I understand that Su Bae is in Saudi to cook up some deals. I also understand a several billion dollar buy back project is ongoing which got announced this morning. But does it really merit a 20% run-up on a multi-billion dollar company? I understand people believe AMD is undervalued compared to NVDA. But don’t you think the undervaluation is somewhat merited due to NVDA dominating the current AI space? Are investors really banking on NVDA not being able to keep up the AI dominance and having AMD slowly chip away at the market share/piece of the pie? Is AMD really banking on increasing their 2nd place spot by hoping and praying the 1st place spot lags or falls behind? 9/10 smart investors should take NVDA over AMD simply because of their numbers. Their business is better, the numbers are better, hello? AMD investors are hoping and wishing that they can keep this whale in its fishing rod, but it’s dragging the whole boat. From a rational standpoint, AMD is way too close to NVDA on the podium. NVDA should be #1 by 10x. AMD can’t keep up. And if investors acted with their rational mind, they would pick the clear winner-picker choice - and not a choice based off a prayer or hope. This 20% weekly gain is not merited, it is irrational and exuberant. ",InternMysterious8476,2025-05-15 02:05:06,4,wallstreetbets,NVDA
$AAPL should move soon?,Took these today. Gave it time as well. Hopeful.,defervenkat,2025-05-14 21:19:41,19,wallstreetbets,AAPL
From $437 to $120K Plus Since the Start of May.,"Started with $437 YOLO on $430 $MSFT calls for earnings. Sold for approximately $7.4K.
YOLO'd it all into $HIMS calls for earnings. Sold for $21.7K. 
YOLO'd it all into $AMD and $SMCI calls and still HODLing hard. 
",applesnappletart,2025-05-14 20:53:18,1762,wallstreetbets,MSFT
Nvda gonna nvda,,Your_Local_Tuba,2025-05-14 20:40:14,18,wallstreetbets,NVDA
"This market is disgustingly overpriced, and we are due for a correction similar to what we saw during Dot Com/Global financial crisis.","I want to preface this by stating that I legitimately home someone can refute what I have to say here. I take no pleasure in the thought of people's 401k's and IRA's and pension funds getting absolutely decimated, and this post has nothing to do with politics... I think the market has been overpriced for a long time (+/- 8 years), and it is only getting worse.

**Some quick points:**

**1. Price to earnings ratio**

Price to earnings ratio is at the point of absolute lunacy. The S&P 500 is over 28 today, and before the market started correcting in February, we were actually over 31. The Nasdaq is at 37 and was as high as 44. While I imagine most in this subreddit at least have a grasp of what P/E means -- for those that don't -- here's a quick summary. For purposes of this post, let's use NVDA as an example. Assume NVDA didn't have a single penny in expenses. They didn't have to pay for employees. They had no rent. There was no salary for Jensen Huang, and they didn't have to pay a penny in taxes. They somehow got all their electricity for free, and they didn't even have a COGS (cost of goods sold) -- somehow they were getting all of their materials for free. Then also assume that their sales remained exactly where they are at today... that their revenue remained identical to where it is at today, and they took 100% of that revenue, and distributed it back among the shareholders of the company. Right now -- NVDA's P/E is at 45.43 -- meaning it would be 45 years before investors recouped their money.

The entire S&P is trading over 28 today... meaning if the +/- 500 largest companies in the USA didn't have a single expense, and continued generating the same revenue, it would take 28 years for investors to get their money back.

Who in the world would be interested in signing up for that ""investment"" opportunity? My own mother could call me asking me to invest in her company and I wouldn't invest based on that return.

**2. The Buffett indicator**

The Buffett indicator is a simple calculation of the total value of the US stock market divided by GDP.

Historically, that number has hung out right around 1-- meaning the total value of the US stock market should be roughly the same as GDP. Buffett himself stated a value of 75-90% is reasonable, and a value over 120% signals the market is overpriced. The highest the buffett indicator has ever hit was during the dot com bubble, when it was 2.1 standard deviations above the trendline. The highest until now, that is. The market value is currently 211% of GDP, or almost 70% above what historically has been seen as normal.

**3. The stock market is insanely top heavy.**

The Mag 7 currently account for 31% of the S&P 500, and over 40% of the Nasdaq. If these 7 stocks correct, it would be absolutely catastrophic for the market as a whole. We saw this play out during Dot Com with the likes of Cisco, Intel, and Oracle. While the market was top heavy then -- it was nowhere near as top heavy as it is today... In fact -- the top 10 most valuable companies now represent more than twice as much of a percentage of value in the market as the top 10 did when Dot Com crashed.

Side note -- but I do think investors have briefly taken note of this. So much of these companies is based on perceived future growth based on revenue that can/will be generated by AI. But remember what happened when DeepSeek emerged last year -- and alerted WallStreet that an incredibly sophisticated AI can be created without pouring billions of dollars into R&D and infrastructure? The market absolutely tanked. What if it becomes obvious that these AI plays will not be unique to the largest tech companies in the world, and that these systems can be developed by any mid-cap with a decent budget?

**4. Home prices and the Housing Market**

I won't dive too deep into this, but homes are more unaffordable today than at any point in US history. Based on median US income and Median US home price, right before the Global financial crisis/mortgage crisis of 08/09 -- this number hit it's highest point in US history -- 45%.

Its highest percent *until* the last 12 months. It now takes over 46% of a family's income to purchase a home.  
30% is the figure that is generally regarded as affordable.

The condo market is collapsing, particularly in Florida, where HOA dues and Insurance costs have made these properties completely unaffordable.

Foreclosures on FHA loans are also set to resume. Biden put in place a policy where anyone that wanted could simply apply for a mortgage payment deferment after COVID... meaning call your servicer, say you're experiencing a hardship, and they simply give you a deferral. None of these homes could be foreclosed upon. They then tack these payments on to the back end of the loan with the additional accrued interest. This policy still exists today, but is about to come to an end in September. As of Q1 2025, over 10.6% of all FHA mortgages are at least one payment late. Over 4% of FHA mortgages are over 90 days late.

What happens when FHA foreclosures absolutely flood the market?

What does this do to home prices, and even more importantly, what does this do to homebuilders? If inventory skyrockets (more than it already has over the last couple of months), and price pressure pushes everything down due to increased supply, will home builders still be able to make money? Homebuilding employs over 11 million americans... Plumbers, electricians, roofers, landscapers, drywallers, framers, truck drivers, etc --

When homes stop being built, unemployment skyrockets, and GDP shrinks dramatically.

**5. Consumer debt is through the roof**

Credit card debt is at the highest it's ever been, and delinquency rates are as high as they've been since emerging from the global financial crisis. Q4 of 2011 was the last time delinquency rates were this high.

Auto loan delinquency rates are the highest they've been in decades.

**6. Bonds -- worldwide -- are pushing higher and higher.**

The US is getting hit here worse than most, as it seems people are not excited about Trump's game of chicken with tariffs. Nonetheless -- you are seeing bond yields push higher and higher worldwide, as investors demand higher returns for government bonds to account for their perceived risk. Interest rates cuts have not quelled this. Despite 100bps cuts in the federal funds rate since last year, the 10 year t-note is actually up 80 ticks since then.

**7. Commercial real estate**

A massive amount of commercial real-estate will need to be refinanced in the coming 12-24 months -- and you will see these payments skyrocket. Many holders of Commercial real-estate refinanced their properties in the quarters after COVID, when interest rates were incredibly low. Most of these loans are either done on 5-year balloons, or as adjustable rate mortgages. These owners will see their payments jump by 30,50, even 70% as they are forced to refinance these properties and interest rates that are close to double what they were last time. This will be compounded by the fact that many companies moved to work from home models, or at least partial work from home models. Office space vacancy rates have skyrocketed -- meaning less tenants -- all while mortgage payments on these properties is skyrocketing.

**8. Student Loan Debt**

The government's moratorium on student loan payments has officially come to an end. 43 million Americans that have been been able to avoid making payments on their average of $38k in student loan debt for the last 5+ years are now going to have to start making payments. Those that don't will see their credit score be absolutely decimated. What other payments will the begin to fall behind on? As I mentioned previously -- credit card delinquency rates and auto loan delinquency rates are already high -- and rising. How much worse does that get when 15% of the population beings adding a several hundred dollar payment to their expenses each month?

There is a dozen other items I could list here, but in the interest of actually getting some work done today, I'll leave my post there.

I would genuinely love for someone to refute places I'm missing the mark, or why I may be wrong about my assumptions above.

  
Current options positions I hold: 

11 $480 SPY puts Exp 9/19  
Also holding 15 IBIT $70 calls expiring 9/19 as well",Your_Mortgage_Broker,2025-05-14 16:26:52,2011,wallstreetbets,NVDA
"Last week I bought NVDA calls at $7.98 up 964% and now have a profit of $10,845 🚀🚀🚀🚀🚀🚀🚀",,twenson,2025-05-14 15:23:33,100,wallstreetbets,NVDA
GOOGL YOLO,Whats the play here gents? ,MikeOck666,2025-05-14 14:17:29,27,wallstreetbets,GOOGL
SMCI gap up! Turned $600 to $6000 overnight.,What a morning. Had semiconductors on watchlist since NVDA was spiking heavily the past couple of days. Decided to took a gamble on SMCI weeklies since they're cheaper. Was surprised to see it hit and sold most at open. Left a runner just in case it decides to go higher. Happy trading!  ,pennythegreatz,2025-05-14 13:48:16,48,wallstreetbets,NVDA
$2m GOOGL YOLO - Half Out,"will readily admit I'm not a genius for this play considering the entire market has been on fire the last week. If anything, GOOGL has underperformed the MAG7 since I bought these calls. Nevertheless, this YOLO has paid off quite well. Yes, it was a dumb play to put so much in 3 month to expiration calls.

BUT, this is WallStreetBets, what do you expect??

Overall I'm sitting at $268,000 realized profit and $284,000 unrealized gains, for a total of $552,000 of profit as of 5/13. Calls were purchased 5/7. Also, there was some scalping here and there in the last few days, so the cost basis has moved around a bit.

https://preview.redd.it/2s5ejkdz8o0f1.png?width=1642&format=png&auto=webp&s=db3f5049e11eae8b54c9d0da2243dcb250d3b404

https://preview.redd.it/nubp5yn09o0f1.png?width=1412&format=png&auto=webp&s=087427df71b3440fc1581d4663e77e828bc65923

**Update 5/14/25 (4pm EST):**

I sold all my $155C and am holding strong the 320 contracts of the 8/15 $150C

Total realized and unrealized profit: $860k

https://preview.redd.it/bqxf6hba4t0f1.png?width=940&format=png&auto=webp&s=cf6e227eb620fc9c84a4677aaf0a4e934d70b9c4

https://preview.redd.it/q6chygqa4t0f1.png?width=1278&format=png&auto=webp&s=d3c61b7e49566245c00957d5770955937b2fef42

",Solid-Sock-1794,2025-05-14 04:07:29,297,wallstreetbets,GOOGL
"r/Stocks Daily Discussion & Fundamentals Friday Jun 06, 2025","This is the daily discussion, so anything stocks related is fine, but the theme for today is on fundamentals, but if fundamentals aren't your thing then just ignore the theme.

Some helpful day to day links, including news:

* [Finviz](https://finviz.com/quote.ashx?t=spy) for charts, fundamentals, and aggregated news on individual stocks
* [Bloomberg market news](https://www.bloomberg.com/markets)
* StreetInsider news:
  * [Market Check](https://www.streetinsider.com/Market+Check) - Possibly why the market is doing what it's doing including sudden spikes/dips
  * [Reuters aggregated](https://www.streetinsider.com/Reuters) - Global news

-----

Most fundamentals are updated every 3 months due to the fact that corporations release earnings reports every quarter, so traders are always speculating at what those earnings will say, and investors may change the size of their holdings based on those reports.

Expect a lot of volatility around earnings, but it usually doesn't matter if you're holding long term, but keep in mind the importance of earnings reports because a trend of declining earnings or a decline in some other fundamental will drive the stock down over the long term as well.

But growth stocks don't rely so much on EPS or revenue as long as they beat some other metric like subscriber count:  Going from 1 million to 10 million subscribers means more revenue in the future.

Value stocks do rely on earnings reports, investors look for wall street expectations to be beaten on both EPS & revenue.  You'll also find value stocks pay dividends, but never invest in a company solely for its dividend.


See the following word cloud and click through for the wiki:

[Market Cap - Shares Outstanding - Volume - Dividend - EPS - P/E Ratio - EPS Q/Q - PEG - Sales Q/Q - Return on Assets (ROA) - Return on Equity (ROE) - BETA - SMA - quarterly earnings](https://www.reddit.com/r/stocks/wiki/fundamentals-themed-post)

If you have a basic question, for example ""what is EBITDA,"" then google ""investopedia EBITDA"" and click the Investopedia article on it; do this for everything until you have a more in depth question or just want to share what you learned.

Useful links:

* [Investopedia page](https://www.investopedia.com/fundamental-analysis-4689757/) on fundamental analysis including [Discounted Cash Flow](https://www.investopedia.com/university/dcf/) analysis; see [definition here](https://www.investopedia.com/terms/d/dcf.asp) and read [their PDF on the topic.](http://i.investopedia.com/inv/pdf/tutorials/fundamentalanalysis_intro.pdf)
* [FINVIZ](https://finviz.com/quote.ashx?t=aapl) for fundamental data, charts, and aggregated news
* [Earnings Whisper](https://www.earningswhispers.com/stocks/aapl) for earnings details

See our past [daily discussions here.](https://www.reddit.com/r/stocks/search?q=author%3Aautomoderator+%22r%2Fstocks+daily+discussion%22&restrict_sr=on&sort=new&t=all)  Also links for:  [Technicals](https://www.reddit.com/r/stocks/search?q=author%3Aautomoderator+title%3Atechnicals&restrict_sr=on&include_over_18=on&sort=new&t=all) Tuesday, [Options Trading](https://www.reddit.com/r/stocks/search?q=author%3Aautomoderator+title%3Aoptions&restrict_sr=on&include_over_18=on&sort=new&t=all) Thursday, and [Fundamentals](https://www.reddit.com/r/stocks/search?q=author%3Aautomoderator+title%3Afundamentals&restrict_sr=on&include_over_18=on&sort=new&t=all) Friday.",AutoModerator,2025-06-06 09:30:32,3,stocks,AAPL
Palantir (PLTR) +74% YTD   Is This the Next Trillion-Dollar AI Giant?,"Not gonna lie, I thought PLTR was just another overhyped tech name back in the day. Fast forward to mid-2025 and it’s the second-best performer in the S&P 500 — up 74% year-to-date, while names like NVDA and AAPL are basically flat or even red. Wild.

So what’s actually driving this monster run? After doing a deep dive, here’s what stood out to me

1. Government Money Flows Where Palantir Goes

This isn’t just a defense contractor story anymore — PLTR is signing fat contracts with every federal agency you can name. $30M with ICE, $795M with the DoD, and even partnering with Fannie Mae (AI + real estate crime detection?).

With Trump 2.0 in office and defense + security spending ramping, this feels like a multi-year tailwind most people are sleeping on

2. The AI Trade That Actually Makes Revenue

While other “AI” plays are still pitching vaporware, Palantir's AI Platform is generating real $$$ — $883.9M in Q1 revenue (+39% YoY), and their U.S. commercial rev is up 71% YoY. Karp says they’re scoring 83% on the ‘Rule of 40’ (basically elite level in software)

Wedbush even said they see this hitting a $1T market cap in 3 years. Bold… but not impossible

3. Retail Conviction Is Back

PLTR is #2 in retail net inflows this week, right behind TSLA. It’s also trending on r/WallStreetBets again — and Karp himself is leaning into it. Dude literally answers retail questions before Wall Street analysts on earnings calls.

Say what you want, but he knows how to play the long game with retail loyalty.

My Take:This isn’t just another meme rally. You’ve got sticky gov contracts, real AI traction, and a growing retail base that isn’t just chasing short-term pumps

That said — it’s run hard. Anyone buying now needs to have conviction beyond just FOMO. But if PLTR keeps executing, this could be one of the few AI stocks that deserves a premium",Necromantion,2025-06-05 23:36:30,0,stocks,"AAPL,NVDA"
WMT & PYPL shareholders reject DEI proposals  focus shifting back to fundamentals?,"Interesting moves at Walmart ($WMT) and PayPal ($PYPL) this week: both companies saw shareholder proposals related to DEI (Diversity, Equity & Inclusion) get rejected  not just anti-DEI, but also pro-DEI proposals. In other words, investors aren’t buying into either extreme.

Walmart already scaled back its DEI efforts quietly last year, even dropping the acronym altogether. Now, shareholders are signaling: *stay the course, stop the distractions.*

PayPal faced a similar situation  a proposal wanted them to disclose potential risks from donating to “politically affiliated” orgs. It failed too.

Here’s where it gets stock-relevant:

Walmart is down \~1.4% after the vote. Minor move, but it mirrors recent trends in consumer reaction to politicized brands.

Foot traffic is down for WMT and Target (which also got DEI backlash), while Costco  openly DEI-supportive  saw +3.8% YoY.

More than 30 WMT shareholders managing $266B in assets expressed *disappointment* over cutting DEI, which shows not all institutional holders agree on the direction.

What’s clear: DEI is becoming a capital markets issue, not just a PR one

This looks like a broader shift toward “de-risking” from polarizing issues. A few years ago, DEI was a must-have checkbox for ESG investors. Now, many large-cap companies  including GOOGL, META, JPM, AMZN  are quietly walking it back.

For WMT and PYPL, this might be a signal that management is prioritizing performance over political signaling  which I see as a **net positive** if you're focused on long-term EPS and consumer sentiment.

",KenKneeHee,2025-06-05 23:20:47,5,stocks,"GOOGL,AMZN"
What are the losers you keep holding and think they would come back? and why?,"As title says. 

What are your material losers (more than 10% paper loss) ? and why you think they’d come back? 

Let me start with sharing mine.. 

1. AGNC. I’ve been holding this forever .. wish interest rate would come down. it pays a 12% dividend so it doesn’t hurt too much

2. Qcom. I have strong conviction of this one. the mobile business especially car will be dominant 

3. LLY. this one is just a sector issue.

4. MRK. don’t understand how this wonderful drug company can end up so,low

5. PFE. it’s paying 7% Dividend and doesn’t hurt that much keep holding as long as it doesn’t go further down

6. psx. energy refinery will come back, just a matter of time

7. cop. as above

8 Aapl. Apple is all about China. i’m like 9% off. not too bad. it shall come back later 

9 BIDU. betting robomtaxi in china.. long term loss anyways.

10 BABA betting AI in china.. long term loss anyways.

11. LDOS. this one I have strong convictio it will go higher. A very good stock

12 LNTH. this one I have strong conviction it will go higher.

  
What are your losers and you are sure they would go higher?",Apprehensive_Two1528,2025-06-05 20:58:01,42,stocks,AAPL
Magnificent Seven power ahead as earnings outpace rest of S&P 500 by nearly 3-to-1,"The Magnificent Seven giants—Apple (NASDAQ:AAPL), Microsoft (NASDAQ:MSFT), Nvidia (NASDAQ:NVDA), Alphabet (NASDAQ:GOOG)(NASDAQ:GOOGL), Amazon (NASDAQ:AMZN), Meta Platforms (NASDAQ:META), and Tesla (NASDAQ:TSLA)—have historically been a strong force in driving U.S. market gains. Their Q2 Y/Y earnings growth was again proof of that when compared to the remaining 493 members of the S&P 500 (SP500).

In the second quarter of 2025, the Magnificent 7 group posted year-over-year earnings growth of 27.7%, which is nearly three times higher than the combined growth of the remaining 493 S&P 500 companies (9.4%), according to FactSet. First quarter earnings were 16.0%, more than triple of the remaining 493 companies (4.8%).

  
Year-to-date price action: TSLA -12.1%, AAPL -18.8%, NVDA +5.5%, META +14.7%, MSFT +9.8%, AMZN -5.3%, and GOOG -11%.

",thelastsubject123,2025-06-05 17:19:03,36,stocks,"GOOGL,AAPL,MSFT,NVDA,AMZN"
CRWV: AI Rocket or Debt Bomb? Thoughts?,"Alright, looked into **CoreWeave (CRWV)**. It's an ""AI Hyperscaler"".. gives GPU (Nvidia) for AI stuff. Stock went nuts since IPO (like 300% up)  

**Quick Take:** CRWV: Big AI growth, Nvidia likes them. BUT huge debt, only 2 big clients (MSFT, OpenAI), and weird deals with Nvidia & Applied Digital where they invest in each other.

**The Good:**

* **AI Demand:** Selling GPU power for AI. Revenue shot up: $229M (2023) to maybe $8B (2025 est).Q1 2025 rev $981.6M, +420% YoY. 
* **Nvidia Favored?** Gets Nvidia's new GPUs (GB200s) early. Nvidia invested, owns \~7%. 
* **Huge Contracts:** $10B Microsoft deal (MSFT is 72% of Q1 rev!).\~$16B from OpenAI. 
* **Stock Surge:** Stock jumped big after IPO from AI hype & news. 

**The Bad:**

* **Massive Debt:** Over $12.7B raised (equity/debt) by end 2024, liabilities >$18.8B Q1 2025. Interest could be $2B+/year.S-1 said ""material weaknesses in internal control"". Not great.  
* **No Profit:** Big revenue, still big losses. Net loss $863M (2024), $314.6M (Q1 2025). 
* **Few Customers:** MSFT is 72% of revenue. OpenAI other main one. Risky.  
* **Nvidia Reliance:** All GPUs from Nvidia. If Nvidia has issues, CRWV does too.  

**The Weird Loops:**

* **Nvidia:**
   * Nvidia investor (\~7% stake). 
   * CRWV buys all GPUs from Nvidia. So NVDA invests, CRWV buys NVDA chips.  
   * NVDA *did* pay CRWV for services ($320M deal 2023).Now NVDA says not a customer, and Q1 rev from them <10%. So NVDA invests -> CRWV buys NVDA GPUs -> NVDA *used to* pay CRWV. Circular.  
* **Applied Digital (APLD):**
   * CRWV has \~$7B, 15yr lease deal with APLD for data centers. 
   * CRWV also has warrants for \~5.5% of APLD. So CRWV is big APLD customer AND investor.  

**So?**

Is CRWV a smart play with AI giants, or a debt bomb waiting to go off if partners, debt, or AI hype fails? They're racing to make cash from contracts to pay debt & upgrade GPUs before tech gets old. 

What u think? Big win or big fail?

*(NFA, my summary, do ur own DD.)*",Norqj,2025-06-05 14:09:42,1,stocks,"MSFT,NVDA"
Is NVIDIA Getting Too Hot? My Short-Term Concerns with NVDA ($141.92),"I wrote my thesis on Palantir 30 mins before posting this one and looks like folks are not liking it. Long term NVDA could go up. This is purely a short term play. 

This is going to be a similar take to that one. 

NVIDIA’s been on an insane run lately. It was up over 20% since mid May and pushing back to all time highs around $142. The AI hype is obviously still alive and well. I genuinely believe AI is the future but still we need to be a bit more realistic.

Here’s what’s making me cautious:

* Options activity is nuts right now — the $140–$150 calls are getting snapped up like crazy
* Lots of short-dated call buying, mostly retail
* The whole “it can’t go down” vibe is creeping back in
* The stock’s up 10–12% straight with barely any pause

To be clear, I’m not saying NVDA is a bad company. It’s a beast, and the AI story is real. But even the strongest stocks usually pull back a bit after a move like this.

I’m looking at a possible short if it pushes into the $143–$145 range. Nothing aggressive, just a trade idea. Thinking we could see a pullback to $135ish (which lines up with the last breakout zone).

If it breaks above $147 though, I’m out. Could easily rip to $150+ from there.

Not trying to fade the long-term trend here. I am just synthesizing unusual market activity, insider moves, options flow, sentiment, technical and news analysis.

Disclaimer: Not Financial Advice.",retroviber,2025-06-05 13:30:57,14,stocks,NVDA
