title,selftext,author,created_utc,score,subreddit,tickers_mentioned
Nvda (Nvidia) upcoming earnings will either pump or dump the market,"The last few nvidia earnings have been okay, and its been trading sideways for the most part. 

This upcoming earnings will be very different. I imagine nvidia earnings will be great, but outlook is the main problem, stock market is very future oriented. Trump has blocked more of nvidia sales to china, but also brokered more deals in the middle east. Tariffs also increasing prices etc. 

My question is what do you think nvidia will report on their future outlook, positive, negative or both? 

Currently ai is whats making the market go up, and nvidia is the current leader. If outlook is slightly negative, I believe the market will dump, if its really negative market is going to bleed badly. 

Currently have 1 month out calls on Nvda, Smci, Mrvl. Will hedge with qqq puts closer to nvidia earnings. I believe nvda will have both positive/negative outlook news, but positive news greatly outweighing the negatives. ",Daydreamer1015,2025-05-25 00:36:42,101,stocks,NVDA
"Dow Jones, S&P 500 and Nasdaq trim losses as Trump threatens new tariffs on Apple and EU","U.S. stocks fell Friday and were on track to record a weekly loss as investors assessed the potential impact of President Trump's latest tariff threats and his massive tax bill on the deficit and economy.

The Dow Jones Industrial Average ( \^DJI ) fell 0.3 percent. The Standard & Poor's 500 ( \^GSPC ) also fell about 0.3 percent. The tech-heavy Nasdaq Composite ( \^IXIC ) was down about 0.6 percent.

Apple Inc (AAPL) must pay a 25 percent tariff on iPhones sold in the U.S. but not made in the U.S., Trump said on Friday, and all three major stock indexes trimmed their losses sharply. The tech giant has begun shifting some of its manufacturing operations to India, while China, home to its main suppliers, is mired in a trade war with the United States. Apple shares fell 3 percent after Trump's tweet on Truth Social.

On Friday afternoon, Trump hinted that the tariffs would apply to other cellphone makers.

Trump told reporters Friday afternoon: ""The tariffs are going to be higher, and Samsung and any company that makes that product is going to be affected, or it's not fair. Again, they don't have tariffs on building factories here. That's why they'll build a factory here.""

Meanwhile, Trump has threatened to raise tariffs on EU imports “right up to 50 percent” as of June 1, as trade talks between China and Europe have stalled.",Aluseda,2025-05-23 19:44:52,119,stocks,AAPL
(05/23) Trump Comments Causing Market Volatility! - Interesting Stocks Today,"AAPL is the most interesting stock today.

[**AAPL (Apple)**](https://finviz.com/quote.ashx?t=AAPL&p=d)\-President Trump has threatened AAPL with a 25% tariff on iPhones not manufactured in the U.S., pressuring the company to shift production domestically. This announcement led to a 3.5% drop in Apple's stock and a broader market sell-off (followed shortly by his comments on Europe). Interested in a short if we break $193 at the open, otherwise more interested in the broad market ETFs. An iPhone made in the US is economically infeasible.

Hi! I am an ex-prop shop equity trader. This is a daily watchlist for short-term trading: I might trade all/none of the stocks listed, and even stocks not listed! I am targeting potentially good candidates for short-term trading; I have no opinion on them as investments. The potential of the stock moving today is what makes it interesting, everything else is secondary.

News: [Trump Rattles Markets With Fresh Tariff Threats on EU, Apple](https://www.bloomberg.com/news/articles/2025-05-23/trump-threatens-a-50-tariff-on-eu-goods-starting-in-june)

[**QQQ**](https://finviz.com/quote.ashx?t=QQQ&p=d)/[**SPY**](https://finviz.com/quote.ashx?t=SPY&p=d)/[**VXX**](https://finviz.com/quote.ashx?t=VXX&p=d)/[**UPRO**](https://finviz.com/quote.ashx?t=UPRO&p=d)\-President Trump recommended a 50% tariff on European Union goods starting June 1, 2025, citing stalled trade negotiations. Interested in if we break $500 level in QQQ/new lows in the market ETFs. Currently long VXX. Here we go again! Escalation of trade tariffs are the main risk here, whether these will be repealed or not, VIX will probably increase over the next few days.

[**BAH (Booz Allen Hamilton Holding)**](https://finviz.com/quote.ashx?t=BAH&p=d)\-BAH reported Q4 adjusted EPS of $1.61, meeting expectations, with revenue of $2.97B vs $3.02B. Provided FY26 guidance below consensus, projecting adjusted EPS of $6.20-$6.55 vs $6.87, and revenue of $12.0-$12.5B vs $12.8B exp. Overall they cited decreased US govt spending as the reason: they're 1/10 firms subject to a federal government “consultant spend review” by cancelling or renegotiating contracts.

[**MSTR (MicroStrategy)**](https://finviz.com/quote.ashx?t=MSTR&p=d)\-MSTR hit highs yesterday, driven by the underlying it's based on reaching an ATH. However, the stock and the underlying sold off mainly due to Trump comments. Pretty much moves with the underlying, currently trading at 1.74x multiple to the amount of C it holds. We're in a weird spot where the stock is ""historically"" at  a lower multiplier than usual but essentially near ATH. Possibly interested in a buy if we sell off hard today, otherwise more interested in the market stocks. ",WinningWatchlist,2025-05-23 13:11:24,7,stocks,AAPL
"r/Stocks Daily Discussion & Fundamentals Friday May 23, 2025","This is the daily discussion, so anything stocks related is fine, but the theme for today is on fundamentals, but if fundamentals aren't your thing then just ignore the theme.

Some helpful day to day links, including news:

* [Finviz](https://finviz.com/quote.ashx?t=spy) for charts, fundamentals, and aggregated news on individual stocks
* [Bloomberg market news](https://www.bloomberg.com/markets)
* StreetInsider news:
  * [Market Check](https://www.streetinsider.com/Market+Check) - Possibly why the market is doing what it's doing including sudden spikes/dips
  * [Reuters aggregated](https://www.streetinsider.com/Reuters) - Global news

-----

Most fundamentals are updated every 3 months due to the fact that corporations release earnings reports every quarter, so traders are always speculating at what those earnings will say, and investors may change the size of their holdings based on those reports.

Expect a lot of volatility around earnings, but it usually doesn't matter if you're holding long term, but keep in mind the importance of earnings reports because a trend of declining earnings or a decline in some other fundamental will drive the stock down over the long term as well.

But growth stocks don't rely so much on EPS or revenue as long as they beat some other metric like subscriber count:  Going from 1 million to 10 million subscribers means more revenue in the future.

Value stocks do rely on earnings reports, investors look for wall street expectations to be beaten on both EPS & revenue.  You'll also find value stocks pay dividends, but never invest in a company solely for its dividend.


See the following word cloud and click through for the wiki:

[Market Cap - Shares Outstanding - Volume - Dividend - EPS - P/E Ratio - EPS Q/Q - PEG - Sales Q/Q - Return on Assets (ROA) - Return on Equity (ROE) - BETA - SMA - quarterly earnings](https://www.reddit.com/r/stocks/wiki/fundamentals-themed-post)

If you have a basic question, for example ""what is EBITDA,"" then google ""investopedia EBITDA"" and click the Investopedia article on it; do this for everything until you have a more in depth question or just want to share what you learned.

Useful links:

* [Investopedia page](https://www.investopedia.com/fundamental-analysis-4689757/) on fundamental analysis including [Discounted Cash Flow](https://www.investopedia.com/university/dcf/) analysis; see [definition here](https://www.investopedia.com/terms/d/dcf.asp) and read [their PDF on the topic.](http://i.investopedia.com/inv/pdf/tutorials/fundamentalanalysis_intro.pdf)
* [FINVIZ](https://finviz.com/quote.ashx?t=aapl) for fundamental data, charts, and aggregated news
* [Earnings Whisper](https://www.earningswhispers.com/stocks/aapl) for earnings details

See our past [daily discussions here.](https://www.reddit.com/r/stocks/search?q=author%3Aautomoderator+%22r%2Fstocks+daily+discussion%22&restrict_sr=on&sort=new&t=all)  Also links for:  [Technicals](https://www.reddit.com/r/stocks/search?q=author%3Aautomoderator+title%3Atechnicals&restrict_sr=on&include_over_18=on&sort=new&t=all) Tuesday, [Options Trading](https://www.reddit.com/r/stocks/search?q=author%3Aautomoderator+title%3Aoptions&restrict_sr=on&include_over_18=on&sort=new&t=all) Thursday, and [Fundamentals](https://www.reddit.com/r/stocks/search?q=author%3Aautomoderator+title%3Afundamentals&restrict_sr=on&include_over_18=on&sort=new&t=all) Friday.",AutoModerator,2025-05-23 09:30:39,14,stocks,AAPL
(05/22) Cloud Computing is Climbing! - Interesting Stocks Today,"Hi! I am an ex-prop shop equity trader. This is a daily watchlist for short-term trading: I might trade all/none of the stocks listed, and even stocks not listed! I am targeting potentially good candidates for short-term trading; I have no opinion on them as investments. The potential of the stock moving today is what makes it interesting, everything else is secondary.

News: [OPEC Discusses Making Another Super Sized Output Hike In July](https://www.bloomberg.com/news/articles/2025-05-22/opec-discusses-making-another-super-sized-output-hike-in-july)

[**SNOW (Snowflake)**](https://finviz.com/quote.ashx?t=SNOW&p=d)\-SNOW reported adjusted EPS of $0.24 vs. $0.21 exp. Raised full-year product revenue guidance to $4.33B vs. $4.29B exp. Q2 product revenue guidance of $1.035B–$1.045B implies \~25% growth (from a random SA article I read). Moved close to 20 points from yesterday, watching $200 level. The cloud computing space has essentially exploded due to the rise of AI, I should've seen SNOW would report good earnings mainly because of CRWV's earnings reporting 400% revenue growth. Random risks I'm thinking of in the long term are the stalling of semis production (and even the demand for it), regulatory actions like what happened to NVDA, competition in the data cloud market, etc.

[**AAPL (Apple)**](https://finviz.com/quote.ashx?t=AAPL&p=d)\-OpenAI announced the acquisition of Jony Ive's AI hardware startup for $6.4B. This is the first shot in what I consider the ""AI Consumer Hardware War"" (sorry Humane Pin, you don't count lol). This positions OpenAI to develop a new generation of AI-powered devices and could challenge Apple in the AI space. Stock fell intraday yesterday 2-3%, interested to see if we continue that selloff. Watching the 200 level as well. Apple has essentially fallen flat with AI (Apple Intelligence) and hasn't struck gold recently with any good hardware, we can safely consider the Apple Vision a bust.

[**FICO (FICO)**](https://finviz.com/quote.ashx?t=FICO&p=d)\-FHFA director William J. Pulte called for the provider of credit scores to be more ""economical"" and that FHFA is considering replacing the tri-merge credit score model with a bi-merge system to cut costs. Already long from $1700 yesterday, we're down close to 30% on a remark that thinks a $1.50 increase in its wholesale royalty for mortgage originations is too high. The price change is $3.50 to $4.95 per score (which may lead to other companies raising their prices). This is my personal opinion- FICO's probably not going to be phased out for mortgages lol. Too many financial/credit institutions use it.

[**CRWV (Coreweave)**](https://finviz.com/quote.ashx?t=CRWV&p=d)\-The stock has been on a monster run, and I'm interested in the short today. We've gone from \~$50 to \~$120 at the peak premarket, watching $100 level to see if we bounce off it or if we continue selling off. Most immediate risk I foresee is massive volatility; we're in speculation territory when it comes to this stock now.

[**UNH (UnitedHealth)**](https://finviz.com/quote.ashx?t=UNH&p=d)\-Reports suggest the insurer made covert payments to nursing homes to limit hospital transfers, aiming to reduce costs, raising concerns over care practices. I won't include the context because I'm sure all of you are sick to death (this is a joke) of hearing about it from Reddit. Broke the $300 level again to the downside, interested to see if this will dump in the open and may try to play a small bounce in this. I exited my main position yesterday (thank god), but looking for other places to enter.

**Earnings today:** [**INTU**](https://finviz.com/quote.ashx?t=INTU&p=d), [**WDAY**](https://finviz.com/quote.ashx?t=WDAY&p=d)

**IPO Today:** HNGE",WinningWatchlist,2025-05-22 12:52:42,6,stocks,"AAPL,NVDA"
"US to keep China chip curbs, spurning Nvidia’s call for relief","No paywall: [https://finance.yahoo.com/news/us-keep-china-chip-curbs-170252299.html](https://finance.yahoo.com/news/us-keep-china-chip-curbs-170252299.html)

Paywall: [https://www.bloomberg.com/news/articles/2025-05-21/us-to-keep-china-chip-curbs-spurning-nvidia-s-call-for-relief](https://www.bloomberg.com/news/articles/2025-05-21/us-to-keep-china-chip-curbs-spurning-nvidia-s-call-for-relief)

(Bloomberg) — The Trump administration will maintain efforts to keep advanced artificial intelligence technology out of China’s hands, a top White House official said, brushing off calls from Nvidia Corp. (NVDA) Chief Executive Officer Jensen Huang to ease restrictions on chip exports to the world’s second largest economy.

“We obviously have huge respect for Jensen,” Sriram Krishnan, White House senior policy adviser for artificial intelligence, said in a Bloomberg Television interview Wednesday. “When it comes to inside China, I do think there is still bipartisan and broad concern about what can happen to these GPUs once they’re physically inside” the country, he added.

While the Trump administration still sees a security risk from widening AI chip exports to China, Krishnan said it agrees with Huang’s view that restrictions on a wide range of other US trading partners need to be revisited. The Trump administration is rescinding and moving to replace the Biden-era AI diffusion rule that Krishnan said created “GPU haves and GPU have nots.”

“When it comes to the rest of the world, we want American AI stack starting from the GPUs to the models to everything on top,” Krishnan said. “On that, Jensen and I and us are in agreement.”

Krishnan spoke hours after Huang made his most forceful public comments to date against escalating US export restrictions aimed at China. Speaking at the Computex industry conference in Taipei, Huang blasted the measures as a “failure” and urged the US to lower barriers to chip sales in China before American firms cede the market to rivals such as Huawei Technologies Co.

Huang told reporters that China will account for a $50 billion opportunity in 2026. “China has 50% of the world’s AI developers, and it’s important that when they develop on an architecture, they develop on Nvidia, or at least American technology,” he said. Nvidia recently wrote off $5.5 billion in H20 AI chips that had been designed to comply with previous export curbs, but were targeted by a new round of restrictions from the Trump administration this year.

Krishnan pointed to the flurry of projects in Saudi Arabia and the United Arab Emirates announced by American companies during President Donald Trump’s trip to the Middle East last week as evidence of a new effort to ease US allies’ access to AI. He stressed that the agreements would still contain security restrictions to prevent the illegal transfer of advanced technology to China and other adversaries.

“These deals and these GPUs are predominantly going to be run by American hyperscalers, American cloud service providers and American companies,” said Krishnan, who was a general partner at venture capital firm Andreessen Horowitz prior to joining the White House. “Most of these GPUs are going to be run, hosted, controlled by American companies.”",callsonreddit,2025-05-21 19:11:49,167,stocks,NVDA
Why is my 4x leveraged NVDA ETF still down even though NVDA recovered?,"I bought a 4x leveraged NVDA stock on TradingView when NVDA dropped to $120 on February 28. NVDA has since recovered to $120, but my leveraged position is still down about 30%.

I’ve read that leveraged ETFs suffer from something called volatility decay, is that what’s happening here?

Should I sell now, or is there a chance the position will recover further?",Astokx,2025-05-21 16:13:10,135,stocks,NVDA
"Stock Buying Platform Recommendation : Robinhood, Charles Schwab, etc","Hi all,

I want to buy certain stocks and hold for 5+ years. Anyone have any recommendation to which 1 platform I should use?

I think most platforms now are $0 fees?

Any advise is appreciated. I am not going to use it to day trade nor do options. Just want to buy a couple of stocks I feel will appreciate well (ex. AAPL, MSFT etc) and just hold for 5+ years.",trevorackerson,2025-05-20 17:09:05,14,stocks,"AAPL,MSFT"
"Smartphone exports from China to US plunge 72% in April, hitting lowest level since 2011 amid tariff tensions","No paywall: [https://finance.yahoo.com/news/chinese-smartphone-exports-us-plunge-073447213.html](https://finance.yahoo.com/news/chinese-smartphone-exports-us-plunge-073447213.html)

Paywall: [https://news.bloombergtax.com/international-trade/chinese-smartphone-exports-to-us-plunge-to-lowest-since-2011](https://news.bloombergtax.com/international-trade/chinese-smartphone-exports-to-us-plunge-to-lowest-since-2011)

(Bloomberg) — Chinese shipments of Apple Inc.’s (AAPL) iPhone and other mobile devices to the US dived to their lowest levels since 2011 in April, underscoring how the threat of US tariffs choked off the flow of big-ticket goods between the world’s two largest economies.

Smartphone exports slid 72% to just under $700 million last month, sharply outpacing an overall 21% drop in Chinese shipments to the US, detailed customs data showed on Tuesday. That highlighted the way the Trump administration’s tariffs campaign — peaking with 145% levies on Chinese goods — is disrupting tech supply chains and diverting electronics elsewhere.

Investors fear a global trade war that would erode some of the US-China bilateral trade that reached $690 billion in 2024, decimating industries and raising prices for consumers. Tensions remain high: Beijing this week accused the Trump administration of undermining recent trade talks in Geneva by pursuing sanctions on Huawei Technologies Co.’s artificial intelligence chips.

Last year, the three biggest US imports from China were smartphones, laptops and lithium-ion batteries, while liquid petroleum gas, oil, soybeans, gas turbines, and machines to make semiconductors were some of the most valuable US exports to China.

The value of phone component exports to India — home to Apple’s biggest iPhone production base outside of China — roughly quadrupled over the course of the past year, according to China’s General Administration of Customs.

Apple has accelerated a shift of production to India, though Trump recently criticized that practice and urged Apple to bring iPhone manufacturing home. The device has never been produced in the US, a project that appears unfeasible at least in the short run.",callsonreddit,2025-05-20 10:51:20,457,stocks,AAPL
"NVDA expects $15B loss in revenue due to ""deeply painful"" H20 Bans","Source: [https://www.barrons.com/articles/nvidia-stock-china-ai-d2cb34ee](https://www.barrons.com/articles/nvidia-stock-china-ai-d2cb34ee)

  
Nvidia CEO Jensen Haung has quantified the revenue impact of the U.S. government’s latest move to limit chip exports to China: $15 billion.



Last month, the administration effectively banned Nvidia’s H20 chips to China by tightening chip export licensing requirements to the Asian country. At the time, Nvidia said it expected to take a $5.5 billion charge related to inventory and purchase commitments from the new restrictions for its fiscal first quarter.

“This additional ban on Nvidia’s H20 is deeply painful,” Huang said in a Stratechery interview published on Monday. “We walked away from $15 billion of sales and probably—what is it? — $3 billion worth of taxes” for the U.S.

Critics have said offering Nvidia’s artificial-intelligence chips to China—even one or two generations old—can help companies in China catch up to the U.S. in AI technology. Huang disagrees. He believes the restrictions are shortsighted and will, in reality, help China in the long run.

A morning briefing on what you need to know in the day ahead, including exclusive commentary from Barron's and MarketWatch writers.

The restrictions opens the market in China for increased usage of Huawei’s AI chips, he said. If more companies use Huawei’s chips and the Chinese company can refine its software, Nvidia’s current CUDA software advantage could erode.

“Anybody who thought that one chess move to somehow ban China from H20s would somehow cut off their ability to do AI is deeply uninformed,” Huang said. “If we don’t compete in China, and we allow the Chinese ecosystem to build a rich ecosystem because we’re not there to compete for it, and new platforms are developed and they’re not American at a time when the world is diffusing AI technology, their leadership and their technology will diffuse all around the world.”

The executive also argues by limiting access to Nvidia’s products it forces companies to provide financial resources to Huawei, which the company will then use for R&D to compete with Nvidia.",thelastsubject123,2025-05-19 20:05:29,581,stocks,NVDA
What upcoming data/reports/events to watch out for that could impact the market?,"Could be good or bad. I’m thinking the market will continue trending slightly upwards until negative economic news/data really starts hitting. What I’m watching out for:

Negative:
1. “Liberation day 2” - if 50+ tariff announcements are made in 2-3 weeks
2. Pharmaceutical tariffs (maybe this week)
3. Semiconductor tariffs (maybe in June)
4. If empty store shelves occurs (if it happens probably in June)
5. If countries retaliate against tariffs: retaliatory tariffs (likely at some point), selling US debt like Japan (unlikely near term), halting US goods purchases (like China did with Boeing)
6. Enforcing sanctions against countries (China) getting oil from Iran
7. Effects of decreased tourism/consumers in foreign countries purchasing less American goods like Canadians/federal and private layoffs/loss of consumer spending and labor from deportations/tariff impacts 

Could swing either way
1. Pce report for April
2. June jobs/inflation/manufacturing reports
3. Q2 gdp report (which could indicate recession)
4. 90 day pause on reciprocal tariffs ending - does Trump extend or enact
5. NVDA earnings
6. Fed June meeting (unlikely to cut rates)
7. Fluctuation of value of the dollar

Positive:
1. Trade agreements/foreign countries agreeing to purchase additional US goods
",IAmDisturbanceFeedMe,2025-05-17 21:37:42,31,stocks,NVDA
Could warren buffett be buying GOOG lately?,Sec gave wb the special treatment of not disclosing the buy of a stock (how nice) and I submit GOOG could be the one that fit his portfolio: great businesses and undervalued.   It’s a nice pairing with his amzn stake.  Grandpa going high tech make it come true!,Agreeable-Purpose-56,2025-05-16 12:03:37,0,stocks,AMZN
