date,company,cleaned_headline
2025-05-29,AAPL,asx market open trump tariff appeal ruling bumps wall street up shakes oz shares may 30 2025
2025-05-29,AAPL,sonder holdings inc receives notification of deficiency from nasdaq related to delayed filing of quarterly report on form 10q
2025-05-29,AAPL,nvidia nvda surges on strong earnings amid us stock market gains
2025-05-29,AAPL,jim cramer on apple inc aapl theyll have the best ai
2025-05-29,AAPL,stock market today sp 500 and nasdaq rally on nvidia earnings court blocks trump tariffs
2025-05-29,AAPL,wedbush apple inc nasdaqaapl could face us pressure but india key to avoiding 3500 iphones
2025-05-29,AAPL,ubs maintains neutral rating on apple aapl keeps 210 pt
2025-05-29,AAPL,apple aapl faces decline in iphone shipments amid rising tariff concerns
2025-05-29,AAPL,investors double down on taco trade after tariff invalidation a tell from nvidia mass layoffs nvidia nasdaqnvda spdr sp 500 arcaspy
2025-05-29,AAPL,affirm expands partnership with williamssonoma inc into canada
2025-05-29,AAPL,how to trade spy and top tech stocks after tariff ruling boosts market
2025-05-29,AAPL,us stocks rise as court ruling weakens trumps tariff authority tech leads rally on nvidia earnings
2025-05-29,AAPL,apples perfect storm tariffs china ai and innovation nasdaqaapl
2025-05-29,AAPL,stock market today futures surge as court blocks trump tariffs and nvidia impresses
2025-05-29,AAPL,podcastone nasdaq podc announces network expansion with launch of five new and acquired podcasts marks 11 additions in 2025 for a total of 208 shows
2025-05-29,AAPL,chip stocks and big tech shares jump on trump tariffs ruling nvidias earnings and elon musk news
2025-05-29,AAPL,stock futures fade overnight gains after activist judges block trump tariffs nvda earnings impress
2025-05-29,AAPL,recovery from startup failure hidden mistakes to avoid now
2025-05-29,AAPL,apple to launch ios 26 macos 26 in major rebrand tied to software redesigns
2025-05-29,AAPL,wall street breakfast podcast judges check trumps trade
2025-05-29,AAPL,a 9 dividend to ride out the us debt downgrade
2025-05-29,AAPL,forget ios 19 your next iphone update could be ios 26 as apple plans major os overhaul
2025-05-29,AAPL,jio platforms finds the right signal with nonconnectivity ventures
2025-05-29,AAPL,google launches direct sales of pixel phones in india a new retail era et retail
2025-05-29,AAPL,if trumps going to outright dismiss courts over liberation day were about to find out
2025-05-29,AAPL,nvda aapl amzn tem tsla 5 trending stocks today apple nasdaqaapl amazoncom nasdaqamzn
2025-05-29,AAPL,apple to launch ios 26 macos 26 in major rebrand tied to software redesigns
2025-05-28,AAPL,asx market open another nearflat morning as rosy nvidia results fail to really excite
2025-05-28,AAPL,apples valuation is priced to perfection thought on the higher end nasdaqaapl
2025-05-28,AAPL,strategic turnaround plans hidden mistakes to avoid now
2025-05-28,AAPL,us tightens china chip curbs by targeting design software
2025-05-28,AAPL,market direction to be driven by nvidia earnings consumer roars back with renewed faith in trump nvidia nasdaqnvda spdr sp 500 arcaspy
2025-05-28,AAPL,apple takes top spot in global smartphone market in q1 counterpoint
2025-05-28,AAPL,evaluating apple against peers in technology hardware storage peripherals industry apple nasdaqaapl
2025-05-28,AAPL,apple inc aapl should be bought on weakness veteran investor says
2025-05-28,AAPL,how to trade nvidia under earnings spotlight nvidia nasdaqnvda
2025-05-28,AAPL,futures erases overnight loss trade higher ahead of nvidia earnings
2025-05-28,AAPL,apple expands self service repair program to ipads aaplnasdaq
2025-05-28,AAPL,the magnificent 7 earnings finale
2025-05-28,AAPL,wall street breakfast podcast shein aims for hong kong ipo
2025-05-28,AAPL,us stocks surge on tariff reprieve and lower yields
2025-05-28,AAPL,tata sons feels the heat as tcs shrinks dividend for the first time in 20 years
2025-05-28,AAPL,trumps 25 tariff threat looms but apple aapl isnt moving yet
2025-05-28,AAPL,texas age verification law texas moves to enforce age verification on app stores amid growing concerns over childrens safety et brandequity
2025-05-28,AAPL,apple ramps up india manufacturing as us iphone imports surge 76 in april while shipments from china plunge apple nasdaqaapl
2025-05-28,AAPL,texas governor signs law mandating age verification on apple and google app stores
2025-05-28,AAPL,bitcoin vegas ten moments that cant be missed in the bull run
2025-05-28,AAPL,apple to launch dedicated gaming app across iphone ipad mac and apple tv
2025-05-28,AAPL,qualcomm modems outperform apples c1 chip in 5g performance study
2025-05-28,AAPL,norways wealth fund ceo demands ai adoption among employees
2025-05-27,AAPL,asx market open unsurprising trump eu backdown spurs markets into week 22 recovery
2025-05-27,AAPL,apple sinks after new 25 tariff announcementwhats the bottom
2025-05-27,AAPL,us stocks surge as trade tensions ease tsla and amd lead gains
2025-05-27,AAPL,trump delays eu tariffs until july 9
2025-05-27,AAPL,apple aapl plans to launch gaming app on its devices aapl stock news
2025-05-27,AAPL,stock market today wall street surges as trump delays eu tariffs
2025-05-27,AAPL,apple aapl makes first foray into gaming by acquiring indie studio rac7 aapl stock news
2025-05-27,AAPL,us major indices have a solid start to the holiday shortened week
2025-05-27,AAPL,trump vs apple we know how this one ends rating upgrade nasdaqaapl
2025-05-27,AAPL,apple aapl sees boost in iphone sales through early discounts in china aapl stock news
2025-05-27,AAPL,aggressive stock buying on japans bond tweak igniting a global bond rally progress with europe spdr sp 500 arcaspy
2025-05-27,AAPL,potential tariffs could significantly raise iphone prices aapl
2025-05-27,AAPL,apple quantifying the impact of 25 tariffs on gross margins nasdaqaapl
2025-05-27,AAPL,india rises shashank manis 5000mile paths to prosperity
2025-05-27,AAPL,todays midday market update stocks rally as trump delays eu tariffs
2025-05-27,AAPL,nvidia nvda earnings awaited as us stocks rise tsla and pdd in focus
2025-05-27,AAPL,market analysis apple and competitors in technology hardware storage peripherals industry apple nasdaqaapl
2025-05-27,AAPL,alt5 sigma integrates lightning network with voltage to enable instant bitcoin payments
2025-05-27,AAPL,apple aapl shields app store from 9 billion in fraudulent transactions
2025-05-27,AAPL,apple aapl faces prolonged selloff amid trumps tariff threats
2025-05-27,AAPL,gibo announces successful application of inspirai in short drama completes thematic creation tests with honeyreels pioneering crossformat innovation in anime and liveaction short drama
2025-05-27,AAPL,apple blocks over 9b in potential fraudulent transactions in last five years aaplnasdaq
2025-05-27,AAPL,apple expands iphones tap to pay to eight more countries in europe aaplnasdaq
2025-05-27,AAPL,dow jones forecast djia rebounds as trump postpones steeper eu tariffs
2025-05-27,AAPL,apple inc aapl is attracting investor attention here is what you should know
2025-05-27,AAPL,apple aapl positioned to benefit from potential usindia trade deal
2025-05-27,AAPL,apple aapl faces significant threat from chatgpt veteran investor says
2025-05-27,AAPL,futures rip higher after trump delays eu tariff hikes
2025-05-27,AAPL,jim cramer warns market could be in trouble if apple nvidia stocks slide this week really bad sign apple nasdaqaapl hon hai precision otchnhpf
2025-05-27,AAPL,stocks jump as japan panics about soaring bond yields
2025-05-27,AAPL,us stock market futures today dow surges over 500 points sp 500 and nasdaq rally as trump delays eu tariffs tech giants like apple microsoft and nvidia lead gains
2025-05-27,AAPL,apple aapl ceo skips middle east trip amid tariff concerns aapl stock news
2025-05-27,AAPL,apple the covert cyclical of the mag 7 nasdaqaapl
2025-05-27,AAPL,stock market today futures rally as trump delays eu tariffs nvidia earnings in focus
2025-05-27,AAPL,wall street breakfast podcast tesla sales tumble in europe
2025-05-27,AAPL,1 nobrainer sp 500 index fund to buy right now for less than 200
2025-05-27,AAPL,us stocks likely to open higher after sp 500s fourday fall market is riskoff says expert apple nasdaqaapl autozone nyseazo
2025-05-27,AAPL,this top vc wants to use main street america as an ai lab
2025-05-27,AAPL,asia markets mixed europe gains dollar strengthens on eu tariff delay global markets today while us slept smartetfs asia pacific dividend builder etf arcaadiv
2025-05-27,AAPL,us stock futures higher after trump said he will delay eu tariffs
2025-05-27,AAPL,the real cost of trumps eu tariffs
2025-05-27,AAPL,trumps recent wrath on apple ceo tim cook is also tied to the middle east not just india report nvidia nasdaqnvda apple nasdaqaapl
2025-05-27,AAPL,us stock futures rally after long weekend on trade reprieve
2025-05-27,AAPL,is the vanguard mega cap growth etf your ticket to mega returns
2025-05-27,AAPL,norway wealth fund chief tells staff that using ai is a must
2025-05-27,AAPL,stock market today futures rally on trumps eu tariff delay as markets reopen after memorial day
2025-05-27,AAPL,stock market today markets rally as trump delays eu tariffs key earnings in focus
2025-05-27,AAPL,sp 500 dips for 4th session amid trumps tariff threats investor sentiment declines fear index remains in greed zone apple nasdaqaapl autozone nyseazo
2025-05-27,AAPL,us stock futures climb as eu tariff delay boosts risk appetite
2025-05-27,AAPL,the oil market has a bigger problem than a slowing china india
2025-05-27,AAPL,yields tariffs and tech can markets hold the line amid the policy storm
2025-05-27,AAPL,cramer suddenly there are many reasons for hope heading into a new trading week
2025-05-26,AAPL,buffett reduces bank betsheres where hes putting capital in 2025
2025-05-26,AAPL,whats next after fridays tariffdriven decline
2025-05-26,AAPL,todays midday market update us markets closed for memorial day as futures signal strong tuesday opening
2025-05-26,AAPL,these are the 4 big things were watching in the stock market in the week ahead
2025-05-26,AAPL,todays midday market update markets rally as trump delays eu tariffs
2025-05-26,AAPL,unlocking intrinsic value analysis of apple inc
2025-05-26,AAPL,stock market today markets rally as trump delays eu tariffs nvidia earnings in focus
2025-05-26,AAPL,stock market today markets mixed as investors eye key tech earnings this week
2025-05-26,AAPL,bitcoin surpasses amazon and alphabet to become worlds 5th largest asset
2025-05-26,AAPL,trump backs down on eu tariffs but us dollar at 1month low
2025-05-26,AAPL,european shares gain after trump pushes back planned 50 tariffs on eu
2025-05-26,AAPL,what investors get wrong about cef fees and miss out on 8 yields
2025-05-26,AAPL,gold rally halts as us signals willingness to discuss trade terms with eu
2025-05-26,AAPL,asian shares mixed as trade fears ebb
2025-05-26,AAPL,stock market today memorial day pause amid trade tensions and upcoming earnings
2025-05-26,AAPL,week ahead bond yields in focus as usjapan divergence widens
2025-05-26,AAPL,trump emphasizes tariff policy aims to boost military equipment and tech manufacturing over textiles we want to make big things apple nasdaqaapl
2025-05-26,AAPL,coreweaves growing way too fast nasdaqcrwv
2025-05-26,AAPL,european shares seen mostly higher at open
2025-05-26,AAPL,sp 500 eps growth may flatline as tariff risks mount before q2 earnings
2025-05-26,AAPL,european shares gain after trump pushes back planned 50 tariffs on eu
2025-05-26,AAPL,us futures rise asian markets slip as donald trump delays eu tariff threat to july
2025-05-26,AAPL,trumps targeting of apple isnt random analyst says its a calculated move for maximum political gain hon hai precision otchnhaf
2025-05-26,AAPL,asian shares us futures rise on eu tariff delay markets wrap
2025-05-26,AAPL,warren buffetts top 5 positions make up 7046 of his portfolio analysis
2025-05-26,AAPL,trumps new tariff threats show trade uncertainty here to stay
2025-05-25,AAPL,recessions signs rise moodys turns the bond market blue
2025-05-25,AAPL,warren buffettled berkshire hathaway has 21 of its 276 billion portfolio in 1 stock thats up 644 in 9 years
2025-05-25,AAPL,see a big stock rally ahead be patient money manager says
2025-05-25,AAPL,264 of warren buffetts 258 billion portfolio is invested in 2 leading artificial intelligence stocks
2025-05-25,AAPL,xiaomi unveils new selfdeveloped chip announces 28b in rd investments over 5 years
2025-05-25,AAPL,3500 american made iphone may slash apple sales by 153 billion
2025-05-25,AAPL,1 stock to buy 1 stock to sell this week nvidia kohls
2025-05-25,AAPL,trumps new tariff threats show trade uncertainty here to stay
2025-05-25,AAPL,buying apple stock isnt worth the risk
2025-05-25,AAPL,nvidia earnings trump tariff updates and the feds preferred inflation gauge what to know this week
2025-05-25,AAPL,apple aapl faces a new kind of rival and wall street is paying attention
2025-05-25,AAPL,charting the global economy us biz under pressure to import during tariff pause
2025-05-25,AAPL,trumps new tariff threats ipos and fii action among 9 factors thatll steer dstreet this week
2025-05-25,AAPL,you can buy netflix and disney stock but what about other streaming services 3 ways to invest
2025-05-24,AAPL,investing in dividend stocks the stability of warren buffetts picks
2025-05-24,AAPL,trump tariff threats target apple aapl
2025-05-24,AAPL,4 a month gene munster unpacks trumps iphone tariff math says market appears to be miscalculating the impact 4 a month gene munster unpacks trumps iphone tariff math says market appears t
2025-05-24,AAPL,exapple engineers behind 200m xnor deal launch elastixai secure 16m to revolutionize ai inference across devices
2025-05-24,AAPL,is now the time to buy beatendown ai stocks
2025-05-24,AAPL,dow jones sp 500 nasdaq composite bond tantrums put trump on notice again
2025-05-24,AAPL,dan ives fires back trumps apple plan needs herculean logistics
2025-05-24,AAPL,trump threatens apple inc aapl with new tariffs if iphones not made in us
2025-05-24,AAPL,trumps commerce secretary says future of american manufacturing is tradecraft jobs that only require high school education
2025-05-24,AAPL,sam altmans 150m ai chip bet crashes rain ai faces sale as openai nvidia and microsoft circle the wreckage
2025-05-24,AAPL,rising bond yields give stockmarket investors the yips watch these levels
2025-05-24,AAPL,alibaba chair says asian firms can look for growth outside of us
2025-05-24,AAPL,can a 10000 investment in soundhound ai turn into 1 million by 2035
2025-05-24,AAPL,the best warren buffett stocks to buy with 1000 right now
2025-05-24,AAPL,bitcoin new alltime high if history is any guide this happens next
2025-05-24,AAPL,stocks tick downward as trump proposes 50 tariff on the european union and 25 tariff on apples iphones
2025-05-24,AAPL,oracle to spend 40 billion on nvidia gb200 chips for openais texas data center report apple nasdaqaapl jpmorgan chase nysejpm
2025-05-24,AAPL,apple would rather absorb a 25 iphone tariff than move production to the us says analyst no guarantee they wont face repeated tariff threats during his term hon hai precision otchnhaf
2025-05-24,AAPL,trump threatens eu smartphones as tariff rhetoric escalates
2025-05-24,AAPL,wall st falls as trump tariff threats spark market uncertainty
2025-05-24,AAPL,wall street slides as trumps tariff threats triggers market uncertainty
2025-05-24,AAPL,dollar global stocks slip as trump threatens tariffs on europe and apple
2025-05-24,AAPL,apple faces first serious threat in 20 years as openai acquires iphone makers former design chief jony ives hardware startup says gene munster
2025-05-24,AAPL,ai investing in canada ai stocks vs tools
2025-05-24,AAPL,tariff long arm of trump law may not pluck apple off india
2025-05-23,AAPL,trump threatens 25 tariff on iphones not made in us targets india production
2025-05-23,AAPL,us stocks decline amid trade tensions aapl suffers losses
2025-05-23,AAPL,market today ftc drops microsoft case salesforce eyes informatica
2025-05-23,AAPL,us stock market today down sp 500 dow jones nasdaq see one of the worst weeks apple share price falls big
2025-05-23,AAPL,sp 500 gains and losses today deckers outdoor ross stores stocks fall as firms withhold outlooks
2025-05-23,AAPL,forexlive americas fx news wrap 23 may pres trump is not partial to who he tariffs
2025-05-23,AAPL,trumps trade spat with europe and apple revives tariff risks for sp 500 apple nasdaqaapl
2025-05-23,AAPL,us stocks climb off early lows but still close firmly negative
2025-05-23,AAPL,stock market today dow sp 500 nasdaq fall as trump tariff threats roar back us deficit anxiety deepens
2025-05-23,AAPL,apples ecosystem is eating hardware nasdaqaapl
2025-05-23,AAPL,trump expands apple tariff threat to iphone rivals but its not helping the stock
2025-05-23,AAPL,apple under fire the 25 tariff threat that could break the stock nasdaqaapl
2025-05-23,AAPL,apple aapl sees increased bearish options activity amid stock decline aapl stock news
2025-05-23,AAPL,why offprice retailer tjx is a buy after falling 3 on a rivals weak guidance
2025-05-23,AAPL,market recap wall street closes mixed amid tariff concerns and tech volatility on friday may 23 2025
2025-05-23,AAPL,apple tariff risk grows analysts say us iphone production is a fairy tale
2025-05-23,AAPL,how much an apple iphone could cost if made in the us
2025-05-23,AAPL,elfun trusts exits unitedhealth group inc impacting portfolio by 179
2025-05-23,AAPL,nuclear stocks rally as trump plans to boost industry
2025-05-23,AAPL,us treasuries hold gains as bessent says slr moves very close
2025-05-23,AAPL,dollar falls to lowest since 2023 as investors eye trade risks
2025-05-23,AAPL,apple rattled as openai acquires io to develop ai devices
2025-05-23,AAPL,musk and tech bros are facing the end of the technipolar moment
2025-05-23,AAPL,apple aapl faces earnings pressure amid tariff concerns
2025-05-23,AAPL,trump tariff blitz on eu and apple triggers global market chaos stocks sink dollar slides gold soars heres what you need to know
2025-05-23,AAPL,apple ceo reaches out to texas governor to amend online childsafety legislation report
2025-05-23,AAPL,apple aapl intensifies opposition to texas age verification bill aapl stock news
2025-05-23,AAPL,failure turnaround stories hidden lessons for new entrepreneurs
2025-05-23,AAPL,top stock movers now apple deckers outdoor intuit and more
2025-05-23,AAPL,trump suggests tariff on apple aapl iphones not made in the usa aapl stock news
2025-05-23,AAPL,gold climbs after trumps eu and apple threats stoke trade fears
2025-05-23,AAPL,apple shares tumble 4 as trump threatens 25 tariff on iphones made outside us
2025-05-23,AAPL,todays midday market update stocks tumble as trade tensions resurface
2025-05-23,AAPL,performance comparison apple and competitors in technology hardware storage peripherals industry apple nasdaqaapl
2025-05-23,AAPL,apple shares fall 4 after trump threatens to impose 25 tariff heres why
2025-05-23,AAPL,our talks going nowhere donald trump threatens to impose 50 tariff on eu imports starting june 1
2025-05-23,AAPL,us stocks off worst levels but still sharply lower after trumps tariff threats
2025-05-23,AAPL,apple shares fall on trump threat make iphones in us or pay 25
2025-05-23,AAPL,morning brew microsoft msft wins ftc battle intuit intu raises guidance
2025-05-23,AAPL,wall street opens sharply lower dow falls over 400 points after trumps tariff threats on eu apple global selloff ensues
2025-05-23,AAPL,nasdaq sp snap 1 at open after trump threatens eu apple with fresh tariffs
2025-05-23,AAPL,trumps tariff threat sinks apple stock a 3500 iphone nightmare
2025-05-23,AAPL,stocks plunge as trump targets europe and apple with steep tariffs
2025-05-23,AAPL,stocks fall as trump targets europe and apple with steep tariffs
2025-05-23,AAPL,4 stocks to watch on friday aapl amzn bah and cprt bahnyse
2025-05-23,AAPL,when do you buy the tariff dip in us stocks when trump tells you
2025-05-23,AAPL,apple raises iphone tradein prices in china to fend off huawei xiaomi amid lagging sales alibaba gr hldgs nysebaba
2025-05-23,AAPL,ross stores rost exceeds q1 expectations amid tariff concerns
2025-05-23,AAPL,sp 500 trump tariff shock could trigger sharp selloff
2025-05-23,AAPL,global markets tumble after trump announces tariffs against european union apple
2025-05-23,AAPL,megacap tech shows signs of life but the road back to aths is still long
2025-05-23,AAPL,futures plunge following trumps tariff threats against eu apple
2025-05-23,AAPL,apple suppliers see red after trump says tech giant must pay tariffs on iphones not made in us
2025-05-23,AAPL,futures plunge after trump threatens 25 tariff on apple 50 on europe bonds bullion bid
2025-05-23,AAPL,futures dip as trump targets apple and eu with tariff threats
2025-05-23,AAPL,trump threatens 25 tariffs on apple if iphones not us made
2025-05-23,AAPL,the eurusd moves lower after trump imposed 50 tariff on eu goods
2025-05-23,AAPL,5 things to know before the stock market opens
2025-05-23,AAPL,trump threatens tim cook to manufacture iphones in the us or face at least 25 tariffs hon hai precision otchnhaf
2025-05-23,AAPL,apple news the good the bad and where it goes from here
2025-05-23,AAPL,apple dives as trump says tariffs must be paid on iphones not made in us aaplnasdaq
2025-05-23,AAPL,berkshire hathaways biggest stocks how the price charts look now
2025-05-23,AAPL,wall street breakfast podcast shared stablecoin
2025-05-23,AAPL,wall st falls as trump tariff threats spark market uncertainty
2025-05-23,AAPL,jamie dimon who once said trump was right about some of china hints at alignment with xi jinping amid washingtonbeijing tensions apple nasdaqaapl jpmorgan chase nysejpm
2025-05-23,AAPL,market watch stock market update for friday may 23 2025
