date,company,cleaned_headline,sentiment,sentiment_score
2025-05-18,GOOGL,artificial intelligence ai infrastructure spend could hit 67 trillion by 2030 according to mckinsey 4 data center stocks to load up on right now like theres no tomorrow,neutral,0.8904329
2025-05-18,GOOGL,alphabet stock has a good chance of winning the ai race nasdaqgoog,positive,0.78972155
2025-05-18,GOOGL,1 beatendown trilliondollar artificial intelligence ai stock to buy on the dip,neutral,0.77409536
2025-05-18,GOOGL,3 tech stocks destined to drive wealth now and for years to come,neutral,0.87492305
2025-05-18,GOOGL,alphabet goog stock rated buy as chrome gains on safari,positive,0.9045819
2025-05-18,GOOGL,alphabet googl hits 150m subscribers on google one platform,positive,0.6914151
2025-05-18,GOOGL,trump tariff uncertainty still makes earnings estimates and guidance useless,neutral,0.9116127
2025-05-18,GOOGL,alphabet stock buy more the best ai play at a reasonable valuation nasdaqgoog,neutral,0.8573362
