date,company,cleaned_headline,sentiment,sentiment_score
2025-05-29,GOOGL,bill nygrens strategic moves constellation brands inc takes center stage with 112 portfolio impact,neutral,0.78456926
2025-05-29,GOOGL,sp 500 gains and losses today hp best buy stocks drop as tariffs weigh on outlook,negative,0.9675704
2025-05-29,GOOGL,google to launch direct sales and physical stores in india,neutral,0.6687722
2025-05-29,GOOGL,jensen huang to offload 6m nvidia shares in 2025,neutral,0.8876948
2025-05-29,GOOGL,cloud wars googles 75b bet against microsoft and amazon,neutral,0.80935717
2025-05-29,GOOGL,investors double down on taco trade after tariff invalidation a tell from nvidia mass layoffs nvidia nasdaqnvda spdr sp 500 arcaspy,negative,0.94374853
2025-05-29,GOOGL,assessing meta platformss performance against competitors in interactive media services industry meta platforms nasdaqmeta,neutral,0.7550361
2025-05-29,GOOGL,new york times agrees to license content to amazon for ai use,neutral,0.52372736
2025-05-29,GOOGL,these 4 quantum stocks outperformed in mayis there more room to run,positive,0.87187946
2025-05-29,GOOGL,how to trade spy and top tech stocks after tariff ruling boosts market,neutral,0.8666745
2025-05-29,GOOGL,google goog collaboration supports nutanixs positive outlook goog stock news,neutral,0.7648923
2025-05-29,GOOGL,chip stocks and big tech shares jump on trump tariffs ruling nvidias earnings and elon musk news,negative,0.72180253
2025-05-29,GOOGL,stock futures fade overnight gains after activist judges block trump tariffs nvda earnings impress,negative,0.87969965
2025-05-29,GOOGL,goog partnership boosts warby parkers market outlook goog stock news,neutral,0.52442145
2025-05-29,GOOGL,google googl launches direct online device sales in india,neutral,0.7655344
2025-05-29,GOOGL,stock market today markets surge as court blocks trump tariffs and nvidia impresses,positive,0.9056609
2025-05-29,GOOGL,c3ai eyes 47 billion agentic ai market by 2030 with 60 million arr we are well positioned to capitalize says ceo c3ai nyseai amazoncom nasdaqamzn,positive,0.72743684
2025-05-29,GOOGL,could ionq become the next nvidia,neutral,0.9369297
2025-05-29,GOOGL,tesla targets june 12 launch of robotaxi service in austin,neutral,0.9184187
2025-05-28,GOOGL,salesforce says ai has reduced hiring of engineers and customer service workers,negative,0.9627197
2025-05-28,GOOGL,alphabet inc goog stock moves 034 what you should know,neutral,0.9212655
2025-05-28,GOOGL,alphabet googl stock moves 031 what you should know,neutral,0.92637855
2025-05-28,GOOGL,market direction to be driven by nvidia earnings consumer roars back with renewed faith in trump nvidia nasdaqnvda spdr sp 500 arcaspy,positive,0.9261378
2025-05-28,GOOGL,for alphabet inc googl ai research monetization is all that matters says jim cramer,neutral,0.93607384
2025-05-28,GOOGL,alphabet googl stock outperforms nasdaq analyst sees promising signs after i,positive,0.91747844
2025-05-28,GOOGL,alphabet googl stock outperforms nasdaq analyst sees promising signs after io,positive,0.9100684
2025-05-28,GOOGL,industry comparison evaluating meta platforms against competitors in interactive media services industry meta platforms nasdaqmeta,neutral,0.8057163
2025-05-28,GOOGL,broadcom avgo is gaining market share in the aichip space tech researcher says,positive,0.93239325
2025-05-28,GOOGL,how to trade nvidia under earnings spotlight nvidia nasdaqnvda,neutral,0.9456813
2025-05-28,GOOGL,uber stock ready to ride higher on waymo partnership,positive,0.84406346
2025-05-28,GOOGL,futures erases overnight loss trade higher ahead of nvidia earnings,positive,0.4444938
2025-05-28,GOOGL,vaneck launches europes first only quantum computing etf,neutral,0.82620233
2025-05-28,GOOGL,nvidias big moment is just ahead heres what to watch for,neutral,0.93154806
2025-05-28,GOOGL,raghuram rajan warns us risks future by curbing foreign students,negative,0.6345692
2025-05-28,GOOGL,alphabet just slashed its stake in this monster artificial intelligence ai cybersecurity stock should you follow,negative,0.8383075
2025-05-28,GOOGL,norways wealth fund ceo demands ai adoption among employees,negative,0.5882503
2025-05-27,GOOGL,us stocks surge as trade tensions ease tsla and amd lead gains,positive,0.7214737
2025-05-27,GOOGL,stock market today wall street surges as trump delays eu tariffs,positive,0.78780365
2025-05-27,GOOGL,democrats favor big tech republicans pick bitcoinetf returns tell the story,neutral,0.9230092
2025-05-27,GOOGL,investing in alphabet with insights from io goog,neutral,0.8450898
2025-05-27,GOOGL,google googl faces fierce competition in ai race goog stock news,negative,0.86341447
2025-05-27,GOOGL,aggressive stock buying on japans bond tweak igniting a global bond rally progress with europe spdr sp 500 arcaspy,positive,0.8034308
2025-05-27,GOOGL,assessing meta platformss performance against competitors in interactive media services industry meta platforms nasdaqmeta,neutral,0.7550361
2025-05-27,GOOGL,nasdaq index trades up 2 on the day sp index up 15,positive,0.93361706
2025-05-27,GOOGL,heres why alphabet goog is on detractors list of loomis sayles global growth fund,neutral,0.93018043
2025-05-27,GOOGL,steve cohen pulls the trigger on this ai powerhouse,neutral,0.8733696
2025-05-27,GOOGL,alphabet continue to milk search while taking over ai nasdaqgoog,neutral,0.8156328
2025-05-27,GOOGL,alphabet ai agents are key to search growth nasdaqgoogl,neutral,0.76915723
2025-05-27,GOOGL,stocks jump as japan panics about soaring bond yields,negative,0.7905224
2025-05-27,GOOGL,us stock futures rise as trump eases eu tariff threat aapl gains,negative,0.42621922
2025-05-27,GOOGL,us stock futures higher after trump said he will delay eu tariffs,positive,0.5561676
2025-05-27,GOOGL,us stock futures rally after long weekend on trade reprieve,negative,0.50473243
2025-05-27,GOOGL,norway wealth fund chief tells staff that using ai is a must,neutral,0.81395805
2025-05-27,GOOGL,youtube ceo neal mohan says the streaming giant must disrupt itself as he reflects on what a future rival might look like alphabet nasdaqgoog alphabet nasdaqgoogl,negative,0.822908
2025-05-27,GOOGL,quantum computing stocks in focus pure play vs large caps heres a look at the valuations alphabet nasdaqgoog amazoncom nasdaqamzn,neutral,0.9384245
2025-05-27,GOOGL,us stock futures climb as eu tariff delay boosts risk appetite,negative,0.50235575
2025-05-26,GOOGL,is unitedhealth the boeing of healthcare why it may be too big to break,neutral,0.8866018
2025-05-26,GOOGL,sa asks what are the best robotaxi stocks right now goognasdaq,neutral,0.93712574
2025-05-26,GOOGL,pe ratio insights for alphabet alphabet nasdaqgoogl,neutral,0.9345321
2025-05-26,GOOGL,investigating meta platformss standing in interactive media services industry compared to competitors meta platforms nasdaqmeta,positive,0.6851378
2025-05-26,GOOGL,alphabet stock lagsbut waymo may be its hidden driver,negative,0.54106325
2025-05-26,GOOGL,6 charts that capture nvidias aifueled rise,neutral,0.87396383
2025-05-26,GOOGL,better ai stock soundhound vs broadcom,positive,0.92282224
2025-05-26,GOOGL,amazon microsoft google and shopify are racing to integrate ai now engineers say theyre working faster with less thinking time and more pressure than ever alphabet nasdaqgoog amazoncom n,neutral,0.8251087
2025-05-26,GOOGL,beware the drumbeat of stock prices,neutral,0.7905105
2025-05-25,GOOGL,brins mystery 700 million stock gift went to philanthropies,neutral,0.9473855
2025-05-25,GOOGL,bond yields stocks somethings happening here,neutral,0.85593385
2025-05-25,GOOGL,buying apple stock isnt worth the risk,neutral,0.911875
2025-05-25,GOOGL,alphabet inc googs ai ad strategy expands reach but analyst keeps neutral stance,positive,0.6541881
2025-05-25,GOOGL,charting the global economy us biz under pressure to import during tariff pause,negative,0.5246297
2025-05-25,GOOGL,from parkinsons research to climate change heres where sergey brins gift of alphabet shares worth 700 million went,neutral,0.9221209
2025-05-24,GOOGL,investment bank suggests that alphabet googs valuation could climb significantly,positive,0.94891524
2025-05-24,GOOGL,is now the time to buy beatendown ai stocks,neutral,0.83440834
2025-05-24,GOOGL,trumps commerce secretary says future of american manufacturing is tradecraft jobs that only require high school education,neutral,0.8920655
2025-05-24,GOOGL,what analysts think of nvidia stock ahead of earnings,neutral,0.933627
2025-05-24,GOOGL,these 3 artificial intelligence ai stocks look cheap right now,neutral,0.8956043
2025-05-24,GOOGL,billionaire philippe laffont just sold shares of nvidia and 2 other ai powerhouses and bought shares of this nvidiabacked company,neutral,0.9408439
2025-05-24,GOOGL,even after gifting shares worth 700 million this google billionaire remains one of the richest across the globe,neutral,0.87149787
2025-05-24,GOOGL,apple faces first serious threat in 20 years as openai acquires iphone makers former design chief jony ives hardware startup says gene munster,negative,0.82160497
2025-05-24,GOOGL,david abrams reduces stake in loar holdings inc a strategic portfolio adjustment,neutral,0.90229464
2025-05-23,GOOGL,alphabet goog sees mixed options sentiment amid share price decline goog stock news,negative,0.9161807
2025-05-23,GOOGL,oracle to snap up 40 billion in nvidia chips for openais us supercenter,positive,0.68690836
2025-05-23,GOOGL,the best us communication services stocks to buy,positive,0.6428022
2025-05-23,GOOGL,alphabet is wiping out the ai competition nasdaqgoog,negative,0.6249138
2025-05-23,GOOGL,todays midday market update stocks tumble as trade tensions resurface,negative,0.96738136
2025-05-23,GOOGL,todays midday market update stocks slide as trump tariff threats rattle markets,negative,0.9613018
2025-05-23,GOOGL,googl analyst reiterates market perform on alphabet googl stock news,neutral,0.7924353
2025-05-23,GOOGL,industry comparison evaluating meta platforms against competitors in interactive media services industry meta platforms nasdaqmeta,neutral,0.8057163
2025-05-23,GOOGL,apple shares fall 4 after trump threatens to impose 25 tariff heres why,negative,0.9677615
2025-05-23,GOOGL,alphabet class a googl experiences notable option volume goog stock news,neutral,0.5630127
2025-05-23,GOOGL,megacap tech shows signs of life but the road back to aths is still long,positive,0.7150141
2025-05-23,GOOGL,alphabet googl ai search beginning of the end for reddit,neutral,0.91825336
2025-05-23,GOOGL,nvidia nvda faces challenges amid shifts in ai spending,negative,0.7840001
2025-05-23,GOOGL,alphabet inc goog carrying out proactive disruption of search schwab anchor says,neutral,0.7006593
2025-05-23,GOOGL,stock market today treasury yields weigh on sentiment as markets head into memorial day weekend,negative,0.88037276
2025-05-23,GOOGL,world stocks are mixed and oil prices slip after treasury yields ease,negative,0.9684401
2025-05-23,GOOGL,apple glasses apple plans glasses for 2026 as part of ai push nixes watch with camera et brandequity,neutral,0.9199196
2025-05-23,GOOGL,disney dis sues to block youtube executive appointment,negative,0.7663014
2025-05-23,GOOGL,apple plans glasses for 2026 as part of ai push nixes watch with camera,neutral,0.9322459
2025-05-23,GOOGL,stock market today indexes waver amid deficit concerns and rising treasury yields,negative,0.9653423
2025-05-23,GOOGL,will trumps ban on international students at harvard affect americas soft power in asia,negative,0.55195284
2025-05-23,GOOGL,market watch stock market update for friday may 23 2025,neutral,0.9137828
2025-05-23,GOOGL,dow jones ends flat as treasury yields dip trumps tax bill passed,negative,0.87183356
2025-05-23,GOOGL,americas wolf warriors are getting it all wrong in asia,negative,0.69300866
2025-05-23,GOOGL,alphabet inc googl taps volvo as lead partner for android automotive,positive,0.738655
2025-05-23,GOOGL,mixed us stock market performance amid economic concerns,negative,0.8185529
2025-05-23,GOOGL,treasury yields ease with us stocks flat to up investors assess us tax bill,positive,0.521751
2025-05-23,GOOGL,wall street stocks end mostly flat in choppy trade as treasury yields ease,negative,0.943356
2025-05-22,GOOGL,alphabet gets vote of confidence after google io,neutral,0.82308394
2025-05-22,GOOGL,tech stocks rise as us markets react to tax reform concerns,positive,0.5890162
2025-05-22,GOOGL,keybanc keeps an overweight rating on alphabet inc goog,neutral,0.881508
2025-05-22,GOOGL,stocks close mixed with the dow and sp little changed nasdaq higher,negative,0.4561852
2025-05-22,GOOGL,magnificent seven shareholder meetings on tap taking stock of the economy,neutral,0.91054463
2025-05-22,GOOGL,google faces us antitrust investigation over deal for aifueled chatbots,negative,0.8920424
2025-05-22,GOOGL,market rebounds after steep selloff stock market recap for thursday may 22 2025,negative,0.72976184
2025-05-22,GOOGL,why baidu is the underrated ai stock from the east,neutral,0.9053
2025-05-22,GOOGL,antitrust probe targets googles ai deal with characterai goog,negative,0.93271375
2025-05-22,GOOGL,wall street reboundsbut one wrong move could break it all again,negative,0.69129634
2025-05-22,GOOGL,top stock movers now enphase energy humana coinbase and more,neutral,0.8633371
2025-05-22,GOOGL,alphabet inc googls winning formula financial metrics and competitive strengths,neutral,0.767272
2025-05-22,GOOGL,renaissance hedge funds biggest q1 buys revealed,neutral,0.90717584
2025-05-22,GOOGL,alphabet goog provides growth at a superb price wellknown investor says,positive,0.5725068
2025-05-22,GOOGL,understanding meta platformss position in interactive media services industry compared to competitors meta platforms nasdaqmeta,positive,0.49276346
2025-05-22,GOOGL,sp 500 slightly down after trumps big beautiful tax bill wins house vote,negative,0.8705509
2025-05-22,GOOGL,alphabet goog option buyer sees quick gain amid stock movements goog stock news,positive,0.656239
2025-05-22,GOOGL,google goog teams up with warby parker for innovative smart glasses goog stock news,positive,0.7139387
2025-05-22,GOOGL,from sundar pichais 92 mentions of ai to gemini google io was all about artificial intelligence,neutral,0.9297426
2025-05-22,GOOGL,market update us tax bill eurozone pmi and sp 500 technicals,neutral,0.9278741
2025-05-22,GOOGL,7 ways to invest in spacex,neutral,0.8982535
2025-05-22,GOOGL,futures treasuries slide after big beautiful bill passes,negative,0.9300422
2025-05-22,GOOGL,us stock market futures wall street rebounds as dow sp 500 and nasdaq rise top gainers losers investor picks and caution ahead,negative,0.63848555
2025-05-22,GOOGL,stock market today markets tumble as bond yields surge,negative,0.96488935
2025-05-22,GOOGL,alphabet inc nasdaqgoogl might not be able to write apple a multibillion dollar check says jim cramer,neutral,0.82182163
2025-05-22,GOOGL,asia and europe markets slide crude oil drops on opec output risk global markets today while us slept smartetfs asia pacific dividend builder etf arcaadiv,negative,0.9258192
2025-05-22,GOOGL,apple faces first serious threat in 20 years as openai acquires iphone makers former design chief jony ives hardware startup says gene munster alphabet nasdaqgoog apple nasdaqaapl,neutral,0.47279263
2025-05-22,GOOGL,wall street stocks end mostly flat in choppy trade as treasury yields ease,negative,0.943356
2025-05-22,GOOGL,short seller andrew lefts citron doubles down on duolingo short says googles ai tool changes the business alphabet nasdaqgoog duolingo nasdaqduol,negative,0.7392655
2025-05-22,GOOGL,market watch stock market rebounds after wednesdays selloff amid deficit concerns,negative,0.9301701
2025-05-22,GOOGL,baidus apollo go enters dubai and abu dhabi ceo robin li touts global robotaxi lead with 14 million rides in q1 baidu nasdaqbidu amazoncom nasdaqamzn,neutral,0.71838427
2025-05-22,GOOGL,goldman sachs reaffirms buy rating for apple aapl amid ai advancements,negative,0.8500214
2025-05-22,GOOGL,googles sergey brin gifts 700 mn in alphabet shares,neutral,0.90132815
2025-05-22,GOOGL,stocks drift to a mixed close as worries about the us governments soaring debt continue to weigh,negative,0.92541915
2025-05-22,GOOGL,from warren buffetts berkshire hathaway to jeff bezos amazon bitcoin is now outshining these wall street titans apple nasdaqaapl,neutral,0.7623965
2025-05-22,GOOGL,us stock market plummets amid rising treasury yields and fiscal concerns,negative,0.95880973
2025-05-21,GOOGL,us stock market declines amid treasury yield surge and economic concerns,negative,0.9465294
2025-05-21,GOOGL,us stock market tumbles amid concerns over tax bill and rising bond yields,negative,0.9586575
2025-05-21,GOOGL,goog integrates ads into ai mode to enhance user engagement,neutral,0.80842733
2025-05-21,GOOGL,sp 500 gains and losses today index slips as congress mulls tax bill treasury yields surge,negative,0.9629629
2025-05-21,GOOGL,google googl prioritizes ai expansion in strategic shift,neutral,0.8827836
2025-05-21,GOOGL,us stocks decline amid rising treasury yields and tax legislation concerns,negative,0.936518
2025-05-21,GOOGL,us stocks tumble yields start to weigh on the equities,negative,0.8137092
2025-05-21,GOOGL,google parent alphabets stock is rising amid growing optimism about ai search,positive,0.94777054
2025-05-21,GOOGL,magnificent 7 earnings preview a pulse check on the us economy,positive,0.5716283
2025-05-21,GOOGL,top stock movers now unitedhealth wolfspeed alphabet and more,neutral,0.89565593
2025-05-21,GOOGL,googl stock rosenblatt maintains neutral rating with 189 price target googl stock news,neutral,0.8845398
2025-05-21,GOOGL,bond reaction to big beautiful tax bill gets in the way of stock market rally spdr sp 500 arcaspy,neutral,0.7075114
2025-05-21,GOOGL,midday market update stocks retreat as target slumps and investors eye tax bill developments,negative,0.95716584
2025-05-21,GOOGL,alphabet shares cross above 200 dma,positive,0.80889684
2025-05-21,GOOGL,stocks are struggling across the board then theres alphabet,negative,0.9504037
2025-05-21,GOOGL,todays midday market update markets retreat as treasury yields climb,negative,0.96110964
2025-05-21,GOOGL,exploring the competitive space meta platforms versus industry peers in interactive media services meta platforms nasdaqmeta,neutral,0.81111026
2025-05-21,GOOGL,google goog partnership boosts warby parkers tech credibility goog stock news,neutral,0.6651304
2025-05-21,GOOGL,goog positive outlook on googles ai innovations boosts confidence goog stock news,positive,0.9163603
2025-05-21,GOOGL,futures slide as 30y yield rises above 5 oil jumps on iran war fears,negative,0.8988315
2025-05-21,GOOGL,amazons zoox expands robotaxi trials to rival turf in atlanta,positive,0.7329233
2025-05-21,GOOGL,google goog advances ai integration across ecosystem bofa sets 200 target goog stock news,neutral,0.8617602
2025-05-21,GOOGL,tesla is 6x more expensive than its peers and the most overvalued mag 7 stock gordon johnson questions fundamentals as elon musk shrugs off concerns apple nasdaqaapl amazoncom nasdaqamzn,positive,0.48092172
2025-05-21,GOOGL,what google searchs chief has to say on aian extension not a replacement,neutral,0.9349524
2025-05-21,GOOGL,market pullback why is the market down today latest stock news for may 21 2025,neutral,0.64354223
2025-05-21,GOOGL,tonix pharmaceuticals announces first patient dosed in phase 2 oasis study of tnx102 sl for reduction of acute stress reaction,positive,0.6647697
2025-05-21,GOOGL,robotaxis will test tesla in a trillion ways,neutral,0.7961813
2025-05-21,GOOGL,if you must buy a mag7 company choose google nasdaqgoog,neutral,0.95090574
2025-05-21,GOOGL,market watch stock market trends and insights for wednesday may 21 2025,neutral,0.908013
2025-05-21,GOOGL,goldmans internet playbook ten themes driving us tech landscape,neutral,0.92049116
2025-05-21,GOOGL,google unveils total reimagining of search with chatbotstyle feature to compete with openai alphabet nasdaqgoog apple nasdaqaapl,positive,0.6721319
2025-05-21,GOOGL,heres how id invest 10000 today,neutral,0.9405723
2025-05-21,GOOGL,market update why is the stock market down today major indexes retreat from recent highs,negative,0.92530024
2025-05-21,GOOGL,hedge funds shift focus to chinese tech stocks amid global market changes,neutral,0.69500655
2025-05-21,GOOGL,cnbc daily open tariff tumult rocking markets doesnt mean artificial intelligence is out of the picture,neutral,0.6146235
2025-05-21,GOOGL,waymo gemini and a 90b quarter why i just bought the most undervalued ai stock,neutral,0.8497149
2025-05-21,GOOGL,google and xreal debut aura ar glasses to rival metas orion plan,positive,0.73305756
2025-05-21,GOOGL,google unveils ai mode transforming search with ai chatbot integration,neutral,0.8608395
2025-05-21,GOOGL,waymo achieves 10 million rides amid growing competition from tesla,positive,0.8802095
2025-05-21,GOOGL,china ai rally laggard baidu faces low bar for earnings boost,negative,0.87672067
2025-05-21,GOOGL,warby parker wrby soars on alphabet partnership,neutral,0.5555337
2025-05-20,GOOGL,apple inc aapl alphabet inc goog have to prove themselves cnbc reporter says,neutral,0.85250205
2025-05-20,GOOGL,sa analyst rating changes goog qcom asml zim goognasdaq,neutral,0.9276949
2025-05-20,GOOGL,google losing the ai race and an ai mini portfolio,negative,0.8891449
2025-05-20,GOOGL,bmo backs alphabet googl says ai search fears overblown,negative,0.940218
2025-05-20,GOOGL,what ray dalios latest moves tell investors,neutral,0.93139756
2025-05-20,GOOGL,market recap sp 500 pauses after sixday rally as trade tensions linger,negative,0.64991146
2025-05-20,GOOGL,insights into meta platformss performance versus peers in interactive media services sector meta platforms nasdaqmeta,neutral,0.69476545
2025-05-20,GOOGL,10 value plays quietly positioning for up to 50 upside in 2025,positive,0.68657994
2025-05-20,GOOGL,how to trade spy and top tech stocks,neutral,0.9382633
2025-05-20,GOOGL,big hit for indians in the us how donald trumps steps to curb migration tax remittances may cost india billions of dollars,negative,0.8705633
2025-05-20,GOOGL,alphabet goog slid on market rotation,negative,0.90336454
2025-05-20,GOOGL,the zacks analyst blog highlights alphabet and adobe,neutral,0.92958146
2025-05-20,GOOGL,futures slide after mondays historic retaildriven rebound,negative,0.9366475
2025-05-20,GOOGL,a onceinadecade opportunity heres why im buying alphabet stock like theres no tomorrow,neutral,0.8781902
2025-05-20,GOOGL,analyst says alphabet goog stock among cheapest ways to gain ai exposure,positive,0.7296201
2025-05-20,GOOGL,wall street breakfast podcast catl soars in hong kong debut,neutral,0.6507275
2025-05-20,GOOGL,1 artificial intelligence ai etf to buy with 1000 and hold forever,neutral,0.8974966
2025-05-20,GOOGL,the ultimate growth stock to buy with 1000 right now,neutral,0.9046598
2025-05-20,GOOGL,4 stocks performing better than big tech,positive,0.93600845
2025-05-20,GOOGL,alphabet things arent looking good but at least its cheap nasdaqgoogl,neutral,0.5054915
2025-05-20,GOOGL,is now a good time to buy stocks whats the best way to invest,neutral,0.80248773
2025-05-19,GOOGL,google decided against offering publishers options in ai search,neutral,0.822524
2025-05-19,GOOGL,pe ratio insights for alphabet alphabet nasdaqgoog,neutral,0.9258603
2025-05-19,GOOGL,microsoft msft expands ai ecosystem and targets 13 billion in revenue,positive,0.82415456
2025-05-19,GOOGL,market recap stocks waver after moodys downgrades us credit rating,negative,0.9356528
2025-05-19,GOOGL,microsoft is bringing elon musks ai models to its cloud,neutral,0.8804672
2025-05-19,GOOGL,options activity and volatility rise for goog goog stock news,neutral,0.5065585
2025-05-19,GOOGL,these undervalued tech stocks could lead the next market rebound,positive,0.5427041
2025-05-19,GOOGL,wall street lunch nvidias huang bets on ai supercomputer factory,neutral,0.65702844
2025-05-19,GOOGL,market midday update indexes tumble following moodys downgrade,negative,0.9690944
2025-05-19,GOOGL,investigating meta platformss standing in interactive media services industry compared to competitors meta platforms nasdaqmeta,positive,0.6851378
2025-05-19,GOOGL,the sp 500 erases losses for the year,negative,0.6224802
2025-05-19,GOOGL,magnificent 7 stocks shift toward stability and selective growth,neutral,0.7616528
2025-05-19,GOOGL,controlling the feed how reddits fundamentals justify its high pe,neutral,0.84907955
2025-05-19,GOOGL,how to trade spy and top tech stocks using technical analysis nvidia nasdaqnvda,neutral,0.9427349
2025-05-19,GOOGL,futures slide yields and gold jump as markets react to moodys downgrade,negative,0.7712952
2025-05-19,GOOGL,magnificent seven valuations plunge to 7year low investors brace for exit,negative,0.9307239
2025-05-19,GOOGL,market tumbles as moodys downgrades us credit rating what investors need to know today,negative,0.5765164
2025-05-19,GOOGL,undervalued and overlooked 3 ai stocks with longterm upside,negative,0.59157604
2025-05-19,GOOGL,apples aipowered home services strategy could upend yelp angi alphabet insider says trust data and ux key in this 500 billion market apple nasdaqaapl amazoncom nasdaqamzn,neutral,0.64901245
2025-05-19,GOOGL,tesla and waymo are poised to poke buffetts golden goose is berkshire hathaway still a safe stock,neutral,0.6933686
2025-05-19,GOOGL,stock market today moodys downgrade sends markets lower after last weeks rally,negative,0.9217932
2025-05-19,GOOGL,crypto highrollers go big on bodyguards to deter kidnappers,neutral,0.8753693
2025-05-19,GOOGL,apple might be in bigger trouble than alphabet nasdaqaapl,negative,0.93459386
2025-05-19,GOOGL,david abrams top 5 positions make up 7995 of his portfolio analysis,neutral,0.947425
2025-05-18,GOOGL,down 12 this year should you buy alphabet stock,negative,0.9308458
